No.     Time           Source                Destination           Protocol Length Info
      1 0.000000       host                  1.16.0                USB      36     GET DESCRIPTOR Request DEVICE

Frame 1: 36 bytes on wire (288 bits), 36 bytes captured (288 bits) on interface \\.\USBPcap1, id 0
USB URB
    [Source: host]
    [Destination: 1.16.0]
    USBPcap pseudoheader length: 28
    IRP ID: 0xffff808210cd4010
    IRP USBD_STATUS: USBD_STATUS_SUCCESS (0x00000000)
    URB Function: URB_FUNCTION_GET_DESCRIPTOR_FROM_DEVICE (0x000b)
    IRP information: 0x00, Direction: FDO -> PDO
    URB bus id: 1
    Device address: 16
    Endpoint: 0x80, Direction: IN
    URB transfer type: URB_CONTROL (0x02)
    Packet Data Length: 8
    [Response in: 2]
    Control transfer stage: Setup (0)
Setup Data
    bmRequestType: 0x80
    bRequest: GET DESCRIPTOR (6)
    Descriptor Index: 0x00
    bDescriptorType: DEVICE (0x01)
    Language Id: no language specified (0x0000)
    wLength: 18

No.     Time           Source                Destination           Protocol Length Info
      2 0.000253       1.16.0                host                  USB      46     GET DESCRIPTOR Response DEVICE

Frame 2: 46 bytes on wire (368 bits), 46 bytes captured (368 bits) on interface \\.\USBPcap1, id 0
USB URB
    [Source: 1.16.0]
    [Destination: host]
    USBPcap pseudoheader length: 28
    IRP ID: 0xffff808210cd4010
    IRP USBD_STATUS: USBD_STATUS_SUCCESS (0x00000000)
    URB Function: URB_FUNCTION_CONTROL_TRANSFER (0x0008)
    IRP information: 0x01, Direction: PDO -> FDO
    URB bus id: 1
    Device address: 16
    Endpoint: 0x80, Direction: IN
    URB transfer type: URB_CONTROL (0x02)
    Packet Data Length: 18
    [Request in: 1]
    [Time from request: 0.000253000 seconds]
    Control transfer stage: Complete (3)
DEVICE DESCRIPTOR
    bLength: 18
    bDescriptorType: 0x01 (DEVICE)
    bcdUSB: 0x0200
    bDeviceClass: Device (0x00)
    bDeviceSubClass: 0
    bDeviceProtocol: 0 (Use class code info from Interface Descriptors)
    bMaxPacketSize0: 64
    idVendor: STMicroelectronics (0x0483)
    idProduct: Unknown (0x572b)
    bcdDevice: 0x0200
    iManufacturer: 1
    iProduct: 2
    iSerialNumber: 3
    bNumConfigurations: 1

No.     Time           Source                Destination           Protocol Length Info
      3 0.000293       host                  1.16.0                USB      36     GET DESCRIPTOR Request CONFIGURATION

Frame 3: 36 bytes on wire (288 bits), 36 bytes captured (288 bits) on interface \\.\USBPcap1, id 0
USB URB
    [Source: host]
    [Destination: 1.16.0]
    USBPcap pseudoheader length: 28
    IRP ID: 0xffff808220603010
    IRP USBD_STATUS: USBD_STATUS_SUCCESS (0x00000000)
    URB Function: URB_FUNCTION_GET_DESCRIPTOR_FROM_DEVICE (0x000b)
    IRP information: 0x00, Direction: FDO -> PDO
    URB bus id: 1
    Device address: 16
    Endpoint: 0x80, Direction: IN
    URB transfer type: URB_CONTROL (0x02)
    Packet Data Length: 8
    [Response in: 4]
    Control transfer stage: Setup (0)
Setup Data
    bmRequestType: 0x80
    bRequest: GET DESCRIPTOR (6)
    Descriptor Index: 0x00
    bDescriptorType: CONFIGURATION (0x02)
    Language Id: no language specified (0x0000)
    wLength: 9

No.     Time           Source                Destination           Protocol Length Info
      4 0.000474       1.16.0                host                  USB      37     GET DESCRIPTOR Response CONFIGURATION

Frame 4: 37 bytes on wire (296 bits), 37 bytes captured (296 bits) on interface \\.\USBPcap1, id 0
USB URB
    [Source: 1.16.0]
    [Destination: host]
    USBPcap pseudoheader length: 28
    IRP ID: 0xffff808220603010
    IRP USBD_STATUS: USBD_STATUS_SUCCESS (0x00000000)
    URB Function: URB_FUNCTION_CONTROL_TRANSFER (0x0008)
    IRP information: 0x01, Direction: PDO -> FDO
    URB bus id: 1
    Device address: 16
    Endpoint: 0x80, Direction: IN
    URB transfer type: URB_CONTROL (0x02)
    Packet Data Length: 9
    [Request in: 3]
    [Time from request: 0.000181000 seconds]
    Control transfer stage: Complete (3)
CONFIGURATION DESCRIPTOR
    bLength: 9
    bDescriptorType: 0x02 (CONFIGURATION)
    wTotalLength: 34
    bNumInterfaces: 1
    bConfigurationValue: 1
    iConfiguration: 0
    Configuration bmAttributes: 0xe0  SELF-POWERED  REMOTE-WAKEUP
    bMaxPower: 50  (100mA)

No.     Time           Source                Destination           Protocol Length Info
      5 0.000482       host                  1.16.0                USB      36     GET DESCRIPTOR Request CONFIGURATION

Frame 5: 36 bytes on wire (288 bits), 36 bytes captured (288 bits) on interface \\.\USBPcap1, id 0
USB URB
    [Source: host]
    [Destination: 1.16.0]
    USBPcap pseudoheader length: 28
    IRP ID: 0xffff80821d6a2010
    IRP USBD_STATUS: USBD_STATUS_SUCCESS (0x00000000)
    URB Function: URB_FUNCTION_GET_DESCRIPTOR_FROM_DEVICE (0x000b)
    IRP information: 0x00, Direction: FDO -> PDO
    URB bus id: 1
    Device address: 16
    Endpoint: 0x80, Direction: IN
    URB transfer type: URB_CONTROL (0x02)
    Packet Data Length: 8
    [Response in: 6]
    Control transfer stage: Setup (0)
Setup Data
    bmRequestType: 0x80
    bRequest: GET DESCRIPTOR (6)
    Descriptor Index: 0x00
    bDescriptorType: CONFIGURATION (0x02)
    Language Id: no language specified (0x0000)
    wLength: 34

No.     Time           Source                Destination           Protocol Length Info
      6 0.000664       1.16.0                host                  USB      62     GET DESCRIPTOR Response CONFIGURATION

Frame 6: 62 bytes on wire (496 bits), 62 bytes captured (496 bits) on interface \\.\USBPcap1, id 0
USB URB
    [Source: 1.16.0]
    [Destination: host]
    USBPcap pseudoheader length: 28
    IRP ID: 0xffff80821d6a2010
    IRP USBD_STATUS: USBD_STATUS_SUCCESS (0x00000000)
    URB Function: URB_FUNCTION_CONTROL_TRANSFER (0x0008)
    IRP information: 0x01, Direction: PDO -> FDO
    URB bus id: 1
    Device address: 16
    Endpoint: 0x80, Direction: IN
    URB transfer type: URB_CONTROL (0x02)
    Packet Data Length: 34
    [Request in: 5]
    [Time from request: 0.000182000 seconds]
    Control transfer stage: Complete (3)
CONFIGURATION DESCRIPTOR
    bLength: 9
    bDescriptorType: 0x02 (CONFIGURATION)
    wTotalLength: 34
    bNumInterfaces: 1
    bConfigurationValue: 1
    iConfiguration: 0
    Configuration bmAttributes: 0xe0  SELF-POWERED  REMOTE-WAKEUP
    bMaxPower: 50  (100mA)
INTERFACE DESCRIPTOR (0.0): class HID
    bLength: 9
    bDescriptorType: 0x04 (INTERFACE)
    bInterfaceNumber: 0
    bAlternateSetting: 0
    bNumEndpoints: 1
    bInterfaceClass: HID (0x03)
    bInterfaceSubClass: Boot Interface (0x01)
    bInterfaceProtocol: Keyboard (0x01)
    iInterface: 0
HID DESCRIPTOR
ENDPOINT DESCRIPTOR
    bLength: 7
    bDescriptorType: 0x05 (ENDPOINT)
    bEndpointAddress: 0x81  IN  Endpoint:1
    bmAttributes: 0x03
    wMaxPacketSize: 8
    bInterval: 10

No.     Time           Source                Destination           Protocol Length Info
      7 0.000683       host                  1.16.0                USB      36     SET CONFIGURATION Request

Frame 7: 36 bytes on wire (288 bits), 36 bytes captured (288 bits) on interface \\.\USBPcap1, id 0
USB URB
    [Source: host]
    [Destination: 1.16.0]
    USBPcap pseudoheader length: 28
    IRP ID: 0xffff8082054e7010
    IRP USBD_STATUS: USBD_STATUS_SUCCESS (0x00000000)
    URB Function: URB_FUNCTION_SELECT_CONFIGURATION (0x0000)
    IRP information: 0x00, Direction: FDO -> PDO
    URB bus id: 1
    Device address: 16
    Endpoint: 0x00, Direction: OUT
    URB transfer type: URB_CONTROL (0x02)
    Packet Data Length: 8
    [Response in: 8]
    Control transfer stage: Setup (0)
Setup Data
    bmRequestType: 0x00
    bRequest: SET CONFIGURATION (9)
    bConfigurationValue: 1
    wIndex: 0 (0x0000)
    wLength: 0

No.     Time           Source                Destination           Protocol Length Info
      8 0.001360       1.16.0                host                  USB      28     SET CONFIGURATION Response

Frame 8: 28 bytes on wire (224 bits), 28 bytes captured (224 bits) on interface \\.\USBPcap1, id 0
USB URB
    [Source: 1.16.0]
    [Destination: host]
    USBPcap pseudoheader length: 28
    IRP ID: 0xffff8082054e7010
    IRP USBD_STATUS: USBD_STATUS_SUCCESS (0x00000000)
    URB Function: URB_FUNCTION_SELECT_CONFIGURATION (0x0000)
    IRP information: 0x01, Direction: PDO -> FDO
    URB bus id: 1
    Device address: 16
    Endpoint: 0x00, Direction: OUT
    URB transfer type: URB_CONTROL (0x02)
    Packet Data Length: 0
    [Request in: 7]
    [Time from request: 0.000677000 seconds]
    Control transfer stage: Complete (3)

No.     Time           Source                Destination           Protocol Length Info
      9 0.001373       host                  1.16.0                USBHID   36     SET_IDLE Request

Frame 9: 36 bytes on wire (288 bits), 36 bytes captured (288 bits) on interface \\.\USBPcap1, id 0
USB URB
    [Source: host]
    [Destination: 1.16.0]
    USBPcap pseudoheader length: 28
    IRP ID: 0xffff80820e1ed010
    IRP USBD_STATUS: USBD_STATUS_SUCCESS (0x00000000)
    URB Function: URB_FUNCTION_CLASS_INTERFACE (0x001b)
    IRP information: 0x00, Direction: FDO -> PDO
    URB bus id: 1
    Device address: 16
    Endpoint: 0x00, Direction: OUT
    URB transfer type: URB_CONTROL (0x02)
    Packet Data Length: 8
    [Response in: 10]
    Control transfer stage: Setup (0)
    [bInterfaceClass: HID (0x03)]
Setup Data
    bmRequestType: 0x21
    bRequest: SET_IDLE (0x0a)
    wValue: 0x0000
    wIndex: 0
    wLength: 0

No.     Time           Source                Destination           Protocol Length Info
     10 0.001492       1.16.0                host                  USBHID   28     SET_IDLE Response

Frame 10: 28 bytes on wire (224 bits), 28 bytes captured (224 bits) on interface \\.\USBPcap1, id 0
USB URB
    [Source: 1.16.0]
    [Destination: host]
    USBPcap pseudoheader length: 28
    IRP ID: 0xffff80820e1ed010
    IRP USBD_STATUS: USBD_STATUS_SUCCESS (0x00000000)
    URB Function: URB_FUNCTION_CONTROL_TRANSFER (0x0008)
    IRP information: 0x01, Direction: PDO -> FDO
    URB bus id: 1
    Device address: 16
    Endpoint: 0x00, Direction: OUT
    URB transfer type: URB_CONTROL (0x02)
    Packet Data Length: 0
    [Request in: 9]
    [Time from request: 0.000119000 seconds]
    Control transfer stage: Complete (3)
    [bInterfaceClass: HID (0x03)]

No.     Time           Source                Destination           Protocol Length Info
     11 0.001568       host                  1.16.0                USBHID   36     GET DESCRIPTOR Request HID Report

Frame 11: 36 bytes on wire (288 bits), 36 bytes captured (288 bits) on interface \\.\USBPcap1, id 0
USB URB
    [Source: host]
    [Destination: 1.16.0]
    USBPcap pseudoheader length: 28
    IRP ID: 0xffff8082092027a0
    IRP USBD_STATUS: USBD_STATUS_SUCCESS (0x00000000)
    URB Function: URB_FUNCTION_GET_DESCRIPTOR_FROM_INTERFACE (0x0028)
    IRP information: 0x00, Direction: FDO -> PDO
    URB bus id: 1
    Device address: 16
    Endpoint: 0x80, Direction: IN
    URB transfer type: URB_CONTROL (0x02)
    Packet Data Length: 8
    [Response in: 12]
    Control transfer stage: Setup (0)
    [bInterfaceClass: HID (0x03)]
Setup Data
    bmRequestType: 0x81
    bDescriptorIndex: 0x00
    bDescriptorType: HID Report (0x22)
    wInterfaceNumber: 0
    wDescriptorLength: 109

No.     Time           Source                Destination           Protocol Length Info
     12 0.001819       1.16.0                host                  USBHID   73     GET DESCRIPTOR Response HID Report

Frame 12: 73 bytes on wire (584 bits), 73 bytes captured (584 bits) on interface \\.\USBPcap1, id 0
USB URB
    [Source: 1.16.0]
    [Destination: host]
    USBPcap pseudoheader length: 28
    IRP ID: 0xffff8082092027a0
    IRP USBD_STATUS: USBD_STATUS_SUCCESS (0x00000000)
    URB Function: URB_FUNCTION_CONTROL_TRANSFER (0x0008)
    IRP information: 0x01, Direction: PDO -> FDO
    URB bus id: 1
    Device address: 16
    Endpoint: 0x80, Direction: IN
    URB transfer type: URB_CONTROL (0x02)
    Packet Data Length: 45
    [Request in: 11]
    [Time from request: 0.000251000 seconds]
    Control transfer stage: Complete (3)
    [bInterfaceClass: HID (0x03)]
HID Report

No.     Time           Source                Destination           Protocol Length Info
     13 0.003427       host                  1.16.1                USB      27     URB_INTERRUPT in

Frame 13: 27 bytes on wire (216 bits), 27 bytes captured (216 bits) on interface \\.\USBPcap1, id 0
USB URB
    [Source: host]
    [Destination: 1.16.1]
    USBPcap pseudoheader length: 27
    IRP ID: 0xffff8082152e77a0
    IRP USBD_STATUS: USBD_STATUS_SUCCESS (0x00000000)
    URB Function: URB_FUNCTION_BULK_OR_INTERRUPT_TRANSFER (0x0009)
    IRP information: 0x00, Direction: FDO -> PDO
    URB bus id: 1
    Device address: 16
    Endpoint: 0x81, Direction: IN
    URB transfer type: URB_INTERRUPT (0x01)
    Packet Data Length: 0
    [Response in: 15]
    [bInterfaceClass: HID (0x03)]

No.     Time           Source                Destination           Protocol Length Info
     14 0.003448       host                  1.16.1                USB      27     URB_INTERRUPT in

Frame 14: 27 bytes on wire (216 bits), 27 bytes captured (216 bits) on interface \\.\USBPcap1, id 0
USB URB
    [Source: host]
    [Destination: 1.16.1]
    USBPcap pseudoheader length: 27
    IRP ID: 0xffff8081ffed67a0
    IRP USBD_STATUS: USBD_STATUS_SUCCESS (0x00000000)
    URB Function: URB_FUNCTION_BULK_OR_INTERRUPT_TRANSFER (0x0009)
    IRP information: 0x00, Direction: FDO -> PDO
    URB bus id: 1
    Device address: 16
    Endpoint: 0x81, Direction: IN
    URB transfer type: URB_INTERRUPT (0x01)
    Packet Data Length: 0
    [Response in: 17]
    [bInterfaceClass: HID (0x03)]

No.     Time           Source                Destination           Protocol Length Info
     15 23.818878      1.16.1                host                  USB      35     URB_INTERRUPT in

Frame 15: 35 bytes on wire (280 bits), 35 bytes captured (280 bits) on interface \\.\USBPcap1, id 0
USB URB
    [Source: 1.16.1]
    [Destination: host]
    USBPcap pseudoheader length: 27
    IRP ID: 0xffff8082152e77a0
    IRP USBD_STATUS: USBD_STATUS_SUCCESS (0x00000000)
    URB Function: URB_FUNCTION_BULK_OR_INTERRUPT_TRANSFER (0x0009)
    IRP information: 0x01, Direction: PDO -> FDO
    URB bus id: 1
    Device address: 16
    Endpoint: 0x81, Direction: IN
    URB transfer type: URB_INTERRUPT (0x01)
    Packet Data Length: 8
    [Request in: 13]
    [Time from request: 23.815451000 seconds]
    [bInterfaceClass: HID (0x03)]
HID Data: 00001e0000000000
    .... ...0 = Key: LeftControl (0xe0): UP
    .... ..0. = Key: LeftShift (0xe1): UP
    .... .0.. = Key: LeftAlt (0xe2): UP
    .... 0... = Key: LeftGUI (0xe3): UP
    ...0 .... = Key: RightControl (0xe4): UP
    ..0. .... = Key: RightShift (0xe5): UP
    .0.. .... = Key: RightAlt (0xe6): UP
    0... .... = Key: RightGUI (0xe7): UP
    Padding: 00
    Array: 1e0000000000
        0001 1110 = Usage: Keyboard 1 and ! (0x0007, 0x001e)
        0000 0000 = Usage: Reserved (no event indicated) (0x0007, 0x0000)
        0000 0000 = Usage: Reserved (no event indicated) (0x0007, 0x0000)
        0000 0000 = Usage: Reserved (no event indicated) (0x0007, 0x0000)
        0000 0000 = Usage: Reserved (no event indicated) (0x0007, 0x0000)
        0000 0000 = Usage: Reserved (no event indicated) (0x0007, 0x0000)

No.     Time           Source                Destination           Protocol Length Info
     16 23.818912      host                  1.16.1                USB      27     URB_INTERRUPT in

Frame 16: 27 bytes on wire (216 bits), 27 bytes captured (216 bits) on interface \\.\USBPcap1, id 0
USB URB
    [Source: host]
    [Destination: 1.16.1]
    USBPcap pseudoheader length: 27
    IRP ID: 0xffff8082152e77a0
    IRP USBD_STATUS: USBD_STATUS_SUCCESS (0x00000000)
    URB Function: URB_FUNCTION_BULK_OR_INTERRUPT_TRANSFER (0x0009)
    IRP information: 0x00, Direction: FDO -> PDO
    URB bus id: 1
    Device address: 16
    Endpoint: 0x81, Direction: IN
    URB transfer type: URB_INTERRUPT (0x01)
    Packet Data Length: 0
    [Response in: 19]
    [bInterfaceClass: HID (0x03)]

No.     Time           Source                Destination           Protocol Length Info
     17 23.826867      1.16.1                host                  USB      35     URB_INTERRUPT in

Frame 17: 35 bytes on wire (280 bits), 35 bytes captured (280 bits) on interface \\.\USBPcap1, id 0
USB URB
    [Source: 1.16.1]
    [Destination: host]
    USBPcap pseudoheader length: 27
    IRP ID: 0xffff8081ffed67a0
    IRP USBD_STATUS: USBD_STATUS_SUCCESS (0x00000000)
    URB Function: URB_FUNCTION_BULK_OR_INTERRUPT_TRANSFER (0x0009)
    IRP information: 0x01, Direction: PDO -> FDO
    URB bus id: 1
    Device address: 16
    Endpoint: 0x81, Direction: IN
    URB transfer type: URB_INTERRUPT (0x01)
    Packet Data Length: 8
    [Request in: 14]
    [Time from request: 23.823419000 seconds]
    [bInterfaceClass: HID (0x03)]
HID Data: 0000000000000000
    .... ...0 = Key: LeftControl (0xe0): UP
    .... ..0. = Key: LeftShift (0xe1): UP
    .... .0.. = Key: LeftAlt (0xe2): UP
    .... 0... = Key: LeftGUI (0xe3): UP
    ...0 .... = Key: RightControl (0xe4): UP
    ..0. .... = Key: RightShift (0xe5): UP
    .0.. .... = Key: RightAlt (0xe6): UP
    0... .... = Key: RightGUI (0xe7): UP
    Padding: 00
    Array: 000000000000
        0000 0000 = Usage: Reserved (no event indicated) (0x0007, 0x0000)
        0000 0000 = Usage: Reserved (no event indicated) (0x0007, 0x0000)
        0000 0000 = Usage: Reserved (no event indicated) (0x0007, 0x0000)
        0000 0000 = Usage: Reserved (no event indicated) (0x0007, 0x0000)
        0000 0000 = Usage: Reserved (no event indicated) (0x0007, 0x0000)
        0000 0000 = Usage: Reserved (no event indicated) (0x0007, 0x0000)

No.     Time           Source                Destination           Protocol Length Info
     18 23.826901      host                  1.16.1                USB      27     URB_INTERRUPT in

Frame 18: 27 bytes on wire (216 bits), 27 bytes captured (216 bits) on interface \\.\USBPcap1, id 0
USB URB
    [Source: host]
    [Destination: 1.16.1]
    USBPcap pseudoheader length: 27
    IRP ID: 0xffff8081ffed67a0
    IRP USBD_STATUS: USBD_STATUS_SUCCESS (0x00000000)
    URB Function: URB_FUNCTION_BULK_OR_INTERRUPT_TRANSFER (0x0009)
    IRP information: 0x00, Direction: FDO -> PDO
    URB bus id: 1
    Device address: 16
    Endpoint: 0x81, Direction: IN
    URB transfer type: URB_INTERRUPT (0x01)
    Packet Data Length: 0
    [Response in: 21]
    [bInterfaceClass: HID (0x03)]

No.     Time           Source                Destination           Protocol Length Info
     19 42.522913      1.16.1                host                  USB      35     URB_INTERRUPT in

Frame 19: 35 bytes on wire (280 bits), 35 bytes captured (280 bits) on interface \\.\USBPcap1, id 0
USB URB
    [Source: 1.16.1]
    [Destination: host]
    USBPcap pseudoheader length: 27
    IRP ID: 0xffff8082152e77a0
    IRP USBD_STATUS: USBD_STATUS_SUCCESS (0x00000000)
    URB Function: URB_FUNCTION_BULK_OR_INTERRUPT_TRANSFER (0x0009)
    IRP information: 0x01, Direction: PDO -> FDO
    URB bus id: 1
    Device address: 16
    Endpoint: 0x81, Direction: IN
    URB transfer type: URB_INTERRUPT (0x01)
    Packet Data Length: 8
    [Request in: 16]
    [Time from request: 18.704001000 seconds]
    [bInterfaceClass: HID (0x03)]
HID Data: 00001f0000000000
    .... ...0 = Key: LeftControl (0xe0): UP
    .... ..0. = Key: LeftShift (0xe1): UP
    .... .0.. = Key: LeftAlt (0xe2): UP
    .... 0... = Key: LeftGUI (0xe3): UP
    ...0 .... = Key: RightControl (0xe4): UP
    ..0. .... = Key: RightShift (0xe5): UP
    .0.. .... = Key: RightAlt (0xe6): UP
    0... .... = Key: RightGUI (0xe7): UP
    Padding: 00
    Array: 1f0000000000
        0001 1111 = Usage: Keyboard 2 and @ (0x0007, 0x001f)
        0000 0000 = Usage: Reserved (no event indicated) (0x0007, 0x0000)
        0000 0000 = Usage: Reserved (no event indicated) (0x0007, 0x0000)
        0000 0000 = Usage: Reserved (no event indicated) (0x0007, 0x0000)
        0000 0000 = Usage: Reserved (no event indicated) (0x0007, 0x0000)
        0000 0000 = Usage: Reserved (no event indicated) (0x0007, 0x0000)

No.     Time           Source                Destination           Protocol Length Info
     20 42.522942      host                  1.16.1                USB      27     URB_INTERRUPT in

Frame 20: 27 bytes on wire (216 bits), 27 bytes captured (216 bits) on interface \\.\USBPcap1, id 0
USB URB
    [Source: host]
    [Destination: 1.16.1]
    USBPcap pseudoheader length: 27
    IRP ID: 0xffff8082152e77a0
    IRP USBD_STATUS: USBD_STATUS_SUCCESS (0x00000000)
    URB Function: URB_FUNCTION_BULK_OR_INTERRUPT_TRANSFER (0x0009)
    IRP information: 0x00, Direction: FDO -> PDO
    URB bus id: 1
    Device address: 16
    Endpoint: 0x81, Direction: IN
    URB transfer type: URB_INTERRUPT (0x01)
    Packet Data Length: 0
    [Response in: 23]
    [bInterfaceClass: HID (0x03)]

No.     Time           Source                Destination           Protocol Length Info
     21 42.530942      1.16.1                host                  USB      35     URB_INTERRUPT in

Frame 21: 35 bytes on wire (280 bits), 35 bytes captured (280 bits) on interface \\.\USBPcap1, id 0
USB URB
    [Source: 1.16.1]
    [Destination: host]
    USBPcap pseudoheader length: 27
    IRP ID: 0xffff8081ffed67a0
    IRP USBD_STATUS: USBD_STATUS_SUCCESS (0x00000000)
    URB Function: URB_FUNCTION_BULK_OR_INTERRUPT_TRANSFER (0x0009)
    IRP information: 0x01, Direction: PDO -> FDO
    URB bus id: 1
    Device address: 16
    Endpoint: 0x81, Direction: IN
    URB transfer type: URB_INTERRUPT (0x01)
    Packet Data Length: 8
    [Request in: 18]
    [Time from request: 18.704041000 seconds]
    [bInterfaceClass: HID (0x03)]
HID Data: 0000000000000000
    .... ...0 = Key: LeftControl (0xe0): UP
    .... ..0. = Key: LeftShift (0xe1): UP
    .... .0.. = Key: LeftAlt (0xe2): UP
    .... 0... = Key: LeftGUI (0xe3): UP
    ...0 .... = Key: RightControl (0xe4): UP
    ..0. .... = Key: RightShift (0xe5): UP
    .0.. .... = Key: RightAlt (0xe6): UP
    0... .... = Key: RightGUI (0xe7): UP
    Padding: 00
    Array: 000000000000
        0000 0000 = Usage: Reserved (no event indicated) (0x0007, 0x0000)
        0000 0000 = Usage: Reserved (no event indicated) (0x0007, 0x0000)
        0000 0000 = Usage: Reserved (no event indicated) (0x0007, 0x0000)
        0000 0000 = Usage: Reserved (no event indicated) (0x0007, 0x0000)
        0000 0000 = Usage: Reserved (no event indicated) (0x0007, 0x0000)
        0000 0000 = Usage: Reserved (no event indicated) (0x0007, 0x0000)

No.     Time           Source                Destination           Protocol Length Info
     22 42.531017      host                  1.16.1                USB      27     URB_INTERRUPT in

Frame 22: 27 bytes on wire (216 bits), 27 bytes captured (216 bits) on interface \\.\USBPcap1, id 0
USB URB
    [Source: host]
    [Destination: 1.16.1]
    USBPcap pseudoheader length: 27
    IRP ID: 0xffff8081ffed67a0
    IRP USBD_STATUS: USBD_STATUS_SUCCESS (0x00000000)
    URB Function: URB_FUNCTION_BULK_OR_INTERRUPT_TRANSFER (0x0009)
    IRP information: 0x00, Direction: FDO -> PDO
    URB bus id: 1
    Device address: 16
    Endpoint: 0x81, Direction: IN
    URB transfer type: URB_INTERRUPT (0x01)
    Packet Data Length: 0
    [Response in: 25]
    [bInterfaceClass: HID (0x03)]

No.     Time           Source                Destination           Protocol Length Info
     23 57.922891      1.16.1                host                  USB      35     URB_INTERRUPT in

Frame 23: 35 bytes on wire (280 bits), 35 bytes captured (280 bits) on interface \\.\USBPcap1, id 0
USB URB
    [Source: 1.16.1]
    [Destination: host]
    USBPcap pseudoheader length: 27
    IRP ID: 0xffff8082152e77a0
    IRP USBD_STATUS: USBD_STATUS_SUCCESS (0x00000000)
    URB Function: URB_FUNCTION_BULK_OR_INTERRUPT_TRANSFER (0x0009)
    IRP information: 0x01, Direction: PDO -> FDO
    URB bus id: 1
    Device address: 16
    Endpoint: 0x81, Direction: IN
    URB transfer type: URB_INTERRUPT (0x01)
    Packet Data Length: 8
    [Request in: 20]
    [Time from request: 15.399949000 seconds]
    [bInterfaceClass: HID (0x03)]
HID Data: 0000200000000000
    .... ...0 = Key: LeftControl (0xe0): UP
    .... ..0. = Key: LeftShift (0xe1): UP
    .... .0.. = Key: LeftAlt (0xe2): UP
    .... 0... = Key: LeftGUI (0xe3): UP
    ...0 .... = Key: RightControl (0xe4): UP
    ..0. .... = Key: RightShift (0xe5): UP
    .0.. .... = Key: RightAlt (0xe6): UP
    0... .... = Key: RightGUI (0xe7): UP
    Padding: 00
    Array: 200000000000
        0010 0000 = Usage: Keyboard 3 and # (0x0007, 0x0020)
        0000 0000 = Usage: Reserved (no event indicated) (0x0007, 0x0000)
        0000 0000 = Usage: Reserved (no event indicated) (0x0007, 0x0000)
        0000 0000 = Usage: Reserved (no event indicated) (0x0007, 0x0000)
        0000 0000 = Usage: Reserved (no event indicated) (0x0007, 0x0000)
        0000 0000 = Usage: Reserved (no event indicated) (0x0007, 0x0000)

No.     Time           Source                Destination           Protocol Length Info
     24 57.922915      host                  1.16.1                USB      27     URB_INTERRUPT in

Frame 24: 27 bytes on wire (216 bits), 27 bytes captured (216 bits) on interface \\.\USBPcap1, id 0
USB URB
    [Source: host]
    [Destination: 1.16.1]
    USBPcap pseudoheader length: 27
    IRP ID: 0xffff8082152e77a0
    IRP USBD_STATUS: USBD_STATUS_SUCCESS (0x00000000)
    URB Function: URB_FUNCTION_BULK_OR_INTERRUPT_TRANSFER (0x0009)
    IRP information: 0x00, Direction: FDO -> PDO
    URB bus id: 1
    Device address: 16
    Endpoint: 0x81, Direction: IN
    URB transfer type: URB_INTERRUPT (0x01)
    Packet Data Length: 0
    [Response in: 27]
    [bInterfaceClass: HID (0x03)]

No.     Time           Source                Destination           Protocol Length Info
     25 57.930908      1.16.1                host                  USB      35     URB_INTERRUPT in

Frame 25: 35 bytes on wire (280 bits), 35 bytes captured (280 bits) on interface \\.\USBPcap1, id 0
USB URB
    [Source: 1.16.1]
    [Destination: host]
    USBPcap pseudoheader length: 27
    IRP ID: 0xffff8081ffed67a0
    IRP USBD_STATUS: USBD_STATUS_SUCCESS (0x00000000)
    URB Function: URB_FUNCTION_BULK_OR_INTERRUPT_TRANSFER (0x0009)
    IRP information: 0x01, Direction: PDO -> FDO
    URB bus id: 1
    Device address: 16
    Endpoint: 0x81, Direction: IN
    URB transfer type: URB_INTERRUPT (0x01)
    Packet Data Length: 8
    [Request in: 22]
    [Time from request: 15.399891000 seconds]
    [bInterfaceClass: HID (0x03)]
HID Data: 0000000000000000
    .... ...0 = Key: LeftControl (0xe0): UP
    .... ..0. = Key: LeftShift (0xe1): UP
    .... .0.. = Key: LeftAlt (0xe2): UP
    .... 0... = Key: LeftGUI (0xe3): UP
    ...0 .... = Key: RightControl (0xe4): UP
    ..0. .... = Key: RightShift (0xe5): UP
    .0.. .... = Key: RightAlt (0xe6): UP
    0... .... = Key: RightGUI (0xe7): UP
    Padding: 00
    Array: 000000000000
        0000 0000 = Usage: Reserved (no event indicated) (0x0007, 0x0000)
        0000 0000 = Usage: Reserved (no event indicated) (0x0007, 0x0000)
        0000 0000 = Usage: Reserved (no event indicated) (0x0007, 0x0000)
        0000 0000 = Usage: Reserved (no event indicated) (0x0007, 0x0000)
        0000 0000 = Usage: Reserved (no event indicated) (0x0007, 0x0000)
        0000 0000 = Usage: Reserved (no event indicated) (0x0007, 0x0000)

No.     Time           Source                Destination           Protocol Length Info
     26 57.930941      host                  1.16.1                USB      27     URB_INTERRUPT in

Frame 26: 27 bytes on wire (216 bits), 27 bytes captured (216 bits) on interface \\.\USBPcap1, id 0
USB URB
    [Source: host]
    [Destination: 1.16.1]
    USBPcap pseudoheader length: 27
    IRP ID: 0xffff8081ffed67a0
    IRP USBD_STATUS: USBD_STATUS_SUCCESS (0x00000000)
    URB Function: URB_FUNCTION_BULK_OR_INTERRUPT_TRANSFER (0x0009)
    IRP information: 0x00, Direction: FDO -> PDO
    URB bus id: 1
    Device address: 16
    Endpoint: 0x81, Direction: IN
    URB transfer type: URB_INTERRUPT (0x01)
    Packet Data Length: 0
    [Response in: 29]
    [bInterfaceClass: HID (0x03)]

No.     Time           Source                Destination           Protocol Length Info
     27 59.562900      1.16.1                host                  USB      35     URB_INTERRUPT in

Frame 27: 35 bytes on wire (280 bits), 35 bytes captured (280 bits) on interface \\.\USBPcap1, id 0
USB URB
    [Source: 1.16.1]
    [Destination: host]
    USBPcap pseudoheader length: 27
    IRP ID: 0xffff8082152e77a0
    IRP USBD_STATUS: USBD_STATUS_SUCCESS (0x00000000)
    URB Function: URB_FUNCTION_BULK_OR_INTERRUPT_TRANSFER (0x0009)
    IRP information: 0x01, Direction: PDO -> FDO
    URB bus id: 1
    Device address: 16
    Endpoint: 0x81, Direction: IN
    URB transfer type: URB_INTERRUPT (0x01)
    Packet Data Length: 8
    [Request in: 24]
    [Time from request: 1.639985000 seconds]
    [bInterfaceClass: HID (0x03)]
HID Data: 0000210000000000
    .... ...0 = Key: LeftControl (0xe0): UP
    .... ..0. = Key: LeftShift (0xe1): UP
    .... .0.. = Key: LeftAlt (0xe2): UP
    .... 0... = Key: LeftGUI (0xe3): UP
    ...0 .... = Key: RightControl (0xe4): UP
    ..0. .... = Key: RightShift (0xe5): UP
    .0.. .... = Key: RightAlt (0xe6): UP
    0... .... = Key: RightGUI (0xe7): UP
    Padding: 00
    Array: 210000000000
        0010 0001 = Usage: Keyboard 4 and $ (0x0007, 0x0021)
        0000 0000 = Usage: Reserved (no event indicated) (0x0007, 0x0000)
        0000 0000 = Usage: Reserved (no event indicated) (0x0007, 0x0000)
        0000 0000 = Usage: Reserved (no event indicated) (0x0007, 0x0000)
        0000 0000 = Usage: Reserved (no event indicated) (0x0007, 0x0000)
        0000 0000 = Usage: Reserved (no event indicated) (0x0007, 0x0000)

No.     Time           Source                Destination           Protocol Length Info
     28 59.562929      host                  1.16.1                USB      27     URB_INTERRUPT in

Frame 28: 27 bytes on wire (216 bits), 27 bytes captured (216 bits) on interface \\.\USBPcap1, id 0
USB URB
    [Source: host]
    [Destination: 1.16.1]
    USBPcap pseudoheader length: 27
    IRP ID: 0xffff8082152e77a0
    IRP USBD_STATUS: USBD_STATUS_SUCCESS (0x00000000)
    URB Function: URB_FUNCTION_BULK_OR_INTERRUPT_TRANSFER (0x0009)
    IRP information: 0x00, Direction: FDO -> PDO
    URB bus id: 1
    Device address: 16
    Endpoint: 0x81, Direction: IN
    URB transfer type: URB_INTERRUPT (0x01)
    Packet Data Length: 0
    [Response in: 31]
    [bInterfaceClass: HID (0x03)]

No.     Time           Source                Destination           Protocol Length Info
     29 59.570905      1.16.1                host                  USB      35     URB_INTERRUPT in

Frame 29: 35 bytes on wire (280 bits), 35 bytes captured (280 bits) on interface \\.\USBPcap1, id 0
USB URB
    [Source: 1.16.1]
    [Destination: host]
    USBPcap pseudoheader length: 27
    IRP ID: 0xffff8081ffed67a0
    IRP USBD_STATUS: USBD_STATUS_SUCCESS (0x00000000)
    URB Function: URB_FUNCTION_BULK_OR_INTERRUPT_TRANSFER (0x0009)
    IRP information: 0x01, Direction: PDO -> FDO
    URB bus id: 1
    Device address: 16
    Endpoint: 0x81, Direction: IN
    URB transfer type: URB_INTERRUPT (0x01)
    Packet Data Length: 8
    [Request in: 26]
    [Time from request: 1.639964000 seconds]
    [bInterfaceClass: HID (0x03)]
HID Data: 0000000000000000
    .... ...0 = Key: LeftControl (0xe0): UP
    .... ..0. = Key: LeftShift (0xe1): UP
    .... .0.. = Key: LeftAlt (0xe2): UP
    .... 0... = Key: LeftGUI (0xe3): UP
    ...0 .... = Key: RightControl (0xe4): UP
    ..0. .... = Key: RightShift (0xe5): UP
    .0.. .... = Key: RightAlt (0xe6): UP
    0... .... = Key: RightGUI (0xe7): UP
    Padding: 00
    Array: 000000000000
        0000 0000 = Usage: Reserved (no event indicated) (0x0007, 0x0000)
        0000 0000 = Usage: Reserved (no event indicated) (0x0007, 0x0000)
        0000 0000 = Usage: Reserved (no event indicated) (0x0007, 0x0000)
        0000 0000 = Usage: Reserved (no event indicated) (0x0007, 0x0000)
        0000 0000 = Usage: Reserved (no event indicated) (0x0007, 0x0000)
        0000 0000 = Usage: Reserved (no event indicated) (0x0007, 0x0000)

No.     Time           Source                Destination           Protocol Length Info
     30 59.570939      host                  1.16.1                USB      27     URB_INTERRUPT in

Frame 30: 27 bytes on wire (216 bits), 27 bytes captured (216 bits) on interface \\.\USBPcap1, id 0
USB URB
    [Source: host]
    [Destination: 1.16.1]
    USBPcap pseudoheader length: 27
    IRP ID: 0xffff8081ffed67a0
    IRP USBD_STATUS: USBD_STATUS_SUCCESS (0x00000000)
    URB Function: URB_FUNCTION_BULK_OR_INTERRUPT_TRANSFER (0x0009)
    IRP information: 0x00, Direction: FDO -> PDO
    URB bus id: 1
    Device address: 16
    Endpoint: 0x81, Direction: IN
    URB transfer type: URB_INTERRUPT (0x01)
    Packet Data Length: 0
    [Response in: 33]
    [bInterfaceClass: HID (0x03)]

No.     Time           Source                Destination           Protocol Length Info
     31 61.530905      1.16.1                host                  USB      35     URB_INTERRUPT in

Frame 31: 35 bytes on wire (280 bits), 35 bytes captured (280 bits) on interface \\.\USBPcap1, id 0
USB URB
    [Source: 1.16.1]
    [Destination: host]
    USBPcap pseudoheader length: 27
    IRP ID: 0xffff8082152e77a0
    IRP USBD_STATUS: USBD_STATUS_SUCCESS (0x00000000)
    URB Function: URB_FUNCTION_BULK_OR_INTERRUPT_TRANSFER (0x0009)
    IRP information: 0x01, Direction: PDO -> FDO
    URB bus id: 1
    Device address: 16
    Endpoint: 0x81, Direction: IN
    URB transfer type: URB_INTERRUPT (0x01)
    Packet Data Length: 8
    [Request in: 28]
    [Time from request: 1.967976000 seconds]
    [bInterfaceClass: HID (0x03)]
HID Data: 0000040000000000
    .... ...0 = Key: LeftControl (0xe0): UP
    .... ..0. = Key: LeftShift (0xe1): UP
    .... .0.. = Key: LeftAlt (0xe2): UP
    .... 0... = Key: LeftGUI (0xe3): UP
    ...0 .... = Key: RightControl (0xe4): UP
    ..0. .... = Key: RightShift (0xe5): UP
    .0.. .... = Key: RightAlt (0xe6): UP
    0... .... = Key: RightGUI (0xe7): UP
    Padding: 00
    Array: 040000000000
        0000 0100 = Usage: Keyboard a and A (0x0007, 0x0004)
        0000 0000 = Usage: Reserved (no event indicated) (0x0007, 0x0000)
        0000 0000 = Usage: Reserved (no event indicated) (0x0007, 0x0000)
        0000 0000 = Usage: Reserved (no event indicated) (0x0007, 0x0000)
        0000 0000 = Usage: Reserved (no event indicated) (0x0007, 0x0000)
        0000 0000 = Usage: Reserved (no event indicated) (0x0007, 0x0000)

No.     Time           Source                Destination           Protocol Length Info
     32 61.530938      host                  1.16.1                USB      27     URB_INTERRUPT in

Frame 32: 27 bytes on wire (216 bits), 27 bytes captured (216 bits) on interface \\.\USBPcap1, id 0
USB URB
    [Source: host]
    [Destination: 1.16.1]
    USBPcap pseudoheader length: 27
    IRP ID: 0xffff8082152e77a0
    IRP USBD_STATUS: USBD_STATUS_SUCCESS (0x00000000)
    URB Function: URB_FUNCTION_BULK_OR_INTERRUPT_TRANSFER (0x0009)
    IRP information: 0x00, Direction: FDO -> PDO
    URB bus id: 1
    Device address: 16
    Endpoint: 0x81, Direction: IN
    URB transfer type: URB_INTERRUPT (0x01)
    Packet Data Length: 0
    [Response in: 35]
    [bInterfaceClass: HID (0x03)]

No.     Time           Source                Destination           Protocol Length Info
     33 61.538903      1.16.1                host                  USB      35     URB_INTERRUPT in

Frame 33: 35 bytes on wire (280 bits), 35 bytes captured (280 bits) on interface \\.\USBPcap1, id 0
USB URB
    [Source: 1.16.1]
    [Destination: host]
    USBPcap pseudoheader length: 27
    IRP ID: 0xffff8081ffed67a0
    IRP USBD_STATUS: USBD_STATUS_SUCCESS (0x00000000)
    URB Function: URB_FUNCTION_BULK_OR_INTERRUPT_TRANSFER (0x0009)
    IRP information: 0x01, Direction: PDO -> FDO
    URB bus id: 1
    Device address: 16
    Endpoint: 0x81, Direction: IN
    URB transfer type: URB_INTERRUPT (0x01)
    Packet Data Length: 8
    [Request in: 30]
    [Time from request: 1.967964000 seconds]
    [bInterfaceClass: HID (0x03)]
HID Data: 0000000000000000
    .... ...0 = Key: LeftControl (0xe0): UP
    .... ..0. = Key: LeftShift (0xe1): UP
    .... .0.. = Key: LeftAlt (0xe2): UP
    .... 0... = Key: LeftGUI (0xe3): UP
    ...0 .... = Key: RightControl (0xe4): UP
    ..0. .... = Key: RightShift (0xe5): UP
    .0.. .... = Key: RightAlt (0xe6): UP
    0... .... = Key: RightGUI (0xe7): UP
    Padding: 00
    Array: 000000000000
        0000 0000 = Usage: Reserved (no event indicated) (0x0007, 0x0000)
        0000 0000 = Usage: Reserved (no event indicated) (0x0007, 0x0000)
        0000 0000 = Usage: Reserved (no event indicated) (0x0007, 0x0000)
        0000 0000 = Usage: Reserved (no event indicated) (0x0007, 0x0000)
        0000 0000 = Usage: Reserved (no event indicated) (0x0007, 0x0000)
        0000 0000 = Usage: Reserved (no event indicated) (0x0007, 0x0000)

No.     Time           Source                Destination           Protocol Length Info
     34 61.538935      host                  1.16.1                USB      27     URB_INTERRUPT in

Frame 34: 27 bytes on wire (216 bits), 27 bytes captured (216 bits) on interface \\.\USBPcap1, id 0
USB URB
    [Source: host]
    [Destination: 1.16.1]
    USBPcap pseudoheader length: 27
    IRP ID: 0xffff8081ffed67a0
    IRP USBD_STATUS: USBD_STATUS_SUCCESS (0x00000000)
    URB Function: URB_FUNCTION_BULK_OR_INTERRUPT_TRANSFER (0x0009)
    IRP information: 0x00, Direction: FDO -> PDO
    URB bus id: 1
    Device address: 16
    Endpoint: 0x81, Direction: IN
    URB transfer type: URB_INTERRUPT (0x01)
    Packet Data Length: 0
    [Response in: 37]
    [bInterfaceClass: HID (0x03)]

No.     Time           Source                Destination           Protocol Length Info
     35 62.618901      1.16.1                host                  USB      35     URB_INTERRUPT in

Frame 35: 35 bytes on wire (280 bits), 35 bytes captured (280 bits) on interface \\.\USBPcap1, id 0
USB URB
    [Source: 1.16.1]
    [Destination: host]
    USBPcap pseudoheader length: 27
    IRP ID: 0xffff8082152e77a0
    IRP USBD_STATUS: USBD_STATUS_SUCCESS (0x00000000)
    URB Function: URB_FUNCTION_BULK_OR_INTERRUPT_TRANSFER (0x0009)
    IRP information: 0x01, Direction: PDO -> FDO
    URB bus id: 1
    Device address: 16
    Endpoint: 0x81, Direction: IN
    URB transfer type: URB_INTERRUPT (0x01)
    Packet Data Length: 8
    [Request in: 32]
    [Time from request: 1.087963000 seconds]
    [bInterfaceClass: HID (0x03)]
HID Data: 0000050000000000
    .... ...0 = Key: LeftControl (0xe0): UP
    .... ..0. = Key: LeftShift (0xe1): UP
    .... .0.. = Key: LeftAlt (0xe2): UP
    .... 0... = Key: LeftGUI (0xe3): UP
    ...0 .... = Key: RightControl (0xe4): UP
    ..0. .... = Key: RightShift (0xe5): UP
    .0.. .... = Key: RightAlt (0xe6): UP
    0... .... = Key: RightGUI (0xe7): UP
    Padding: 00
    Array: 050000000000
        0000 0101 = Usage: Keyboard b and B (0x0007, 0x0005)
        0000 0000 = Usage: Reserved (no event indicated) (0x0007, 0x0000)
        0000 0000 = Usage: Reserved (no event indicated) (0x0007, 0x0000)
        0000 0000 = Usage: Reserved (no event indicated) (0x0007, 0x0000)
        0000 0000 = Usage: Reserved (no event indicated) (0x0007, 0x0000)
        0000 0000 = Usage: Reserved (no event indicated) (0x0007, 0x0000)

No.     Time           Source                Destination           Protocol Length Info
     36 62.618929      host                  1.16.1                USB      27     URB_INTERRUPT in

Frame 36: 27 bytes on wire (216 bits), 27 bytes captured (216 bits) on interface \\.\USBPcap1, id 0
USB URB
    [Source: host]
    [Destination: 1.16.1]
    USBPcap pseudoheader length: 27
    IRP ID: 0xffff8082152e77a0
    IRP USBD_STATUS: USBD_STATUS_SUCCESS (0x00000000)
    URB Function: URB_FUNCTION_BULK_OR_INTERRUPT_TRANSFER (0x0009)
    IRP information: 0x00, Direction: FDO -> PDO
    URB bus id: 1
    Device address: 16
    Endpoint: 0x81, Direction: IN
    URB transfer type: URB_INTERRUPT (0x01)
    Packet Data Length: 0
    [Response in: 39]
    [bInterfaceClass: HID (0x03)]

No.     Time           Source                Destination           Protocol Length Info
     37 62.626909      1.16.1                host                  USB      35     URB_INTERRUPT in

Frame 37: 35 bytes on wire (280 bits), 35 bytes captured (280 bits) on interface \\.\USBPcap1, id 0
USB URB
    [Source: 1.16.1]
    [Destination: host]
    USBPcap pseudoheader length: 27
    IRP ID: 0xffff8081ffed67a0
    IRP USBD_STATUS: USBD_STATUS_SUCCESS (0x00000000)
    URB Function: URB_FUNCTION_BULK_OR_INTERRUPT_TRANSFER (0x0009)
    IRP information: 0x01, Direction: PDO -> FDO
    URB bus id: 1
    Device address: 16
    Endpoint: 0x81, Direction: IN
    URB transfer type: URB_INTERRUPT (0x01)
    Packet Data Length: 8
    [Request in: 34]
    [Time from request: 1.087974000 seconds]
    [bInterfaceClass: HID (0x03)]
HID Data: 0000000000000000
    .... ...0 = Key: LeftControl (0xe0): UP
    .... ..0. = Key: LeftShift (0xe1): UP
    .... .0.. = Key: LeftAlt (0xe2): UP
    .... 0... = Key: LeftGUI (0xe3): UP
    ...0 .... = Key: RightControl (0xe4): UP
    ..0. .... = Key: RightShift (0xe5): UP
    .0.. .... = Key: RightAlt (0xe6): UP
    0... .... = Key: RightGUI (0xe7): UP
    Padding: 00
    Array: 000000000000
        0000 0000 = Usage: Reserved (no event indicated) (0x0007, 0x0000)
        0000 0000 = Usage: Reserved (no event indicated) (0x0007, 0x0000)
        0000 0000 = Usage: Reserved (no event indicated) (0x0007, 0x0000)
        0000 0000 = Usage: Reserved (no event indicated) (0x0007, 0x0000)
        0000 0000 = Usage: Reserved (no event indicated) (0x0007, 0x0000)
        0000 0000 = Usage: Reserved (no event indicated) (0x0007, 0x0000)

No.     Time           Source                Destination           Protocol Length Info
     38 62.626955      host                  1.16.1                USB      27     URB_INTERRUPT in

Frame 38: 27 bytes on wire (216 bits), 27 bytes captured (216 bits) on interface \\.\USBPcap1, id 0
USB URB
    [Source: host]
    [Destination: 1.16.1]
    USBPcap pseudoheader length: 27
    IRP ID: 0xffff8081ffed67a0
    IRP USBD_STATUS: USBD_STATUS_SUCCESS (0x00000000)
    URB Function: URB_FUNCTION_BULK_OR_INTERRUPT_TRANSFER (0x0009)
    IRP information: 0x00, Direction: FDO -> PDO
    URB bus id: 1
    Device address: 16
    Endpoint: 0x81, Direction: IN
    URB transfer type: URB_INTERRUPT (0x01)
    Packet Data Length: 0
    [Response in: 41]
    [bInterfaceClass: HID (0x03)]

No.     Time           Source                Destination           Protocol Length Info
     39 64.018904      1.16.1                host                  USB      35     URB_INTERRUPT in

Frame 39: 35 bytes on wire (280 bits), 35 bytes captured (280 bits) on interface \\.\USBPcap1, id 0
USB URB
    [Source: 1.16.1]
    [Destination: host]
    USBPcap pseudoheader length: 27
    IRP ID: 0xffff8082152e77a0
    IRP USBD_STATUS: USBD_STATUS_SUCCESS (0x00000000)
    URB Function: URB_FUNCTION_BULK_OR_INTERRUPT_TRANSFER (0x0009)
    IRP information: 0x01, Direction: PDO -> FDO
    URB bus id: 1
    Device address: 16
    Endpoint: 0x81, Direction: IN
    URB transfer type: URB_INTERRUPT (0x01)
    Packet Data Length: 8
    [Request in: 36]
    [Time from request: 1.399975000 seconds]
    [bInterfaceClass: HID (0x03)]
HID Data: 0000060000000000
    .... ...0 = Key: LeftControl (0xe0): UP
    .... ..0. = Key: LeftShift (0xe1): UP
    .... .0.. = Key: LeftAlt (0xe2): UP
    .... 0... = Key: LeftGUI (0xe3): UP
    ...0 .... = Key: RightControl (0xe4): UP
    ..0. .... = Key: RightShift (0xe5): UP
    .0.. .... = Key: RightAlt (0xe6): UP
    0... .... = Key: RightGUI (0xe7): UP
    Padding: 00
    Array: 060000000000
        0000 0110 = Usage: Keyboard c and C (0x0007, 0x0006)
        0000 0000 = Usage: Reserved (no event indicated) (0x0007, 0x0000)
        0000 0000 = Usage: Reserved (no event indicated) (0x0007, 0x0000)
        0000 0000 = Usage: Reserved (no event indicated) (0x0007, 0x0000)
        0000 0000 = Usage: Reserved (no event indicated) (0x0007, 0x0000)
        0000 0000 = Usage: Reserved (no event indicated) (0x0007, 0x0000)

No.     Time           Source                Destination           Protocol Length Info
     40 64.018941      host                  1.16.1                USB      27     URB_INTERRUPT in

Frame 40: 27 bytes on wire (216 bits), 27 bytes captured (216 bits) on interface \\.\USBPcap1, id 0
USB URB
    [Source: host]
    [Destination: 1.16.1]
    USBPcap pseudoheader length: 27
    IRP ID: 0xffff8082152e77a0
    IRP USBD_STATUS: USBD_STATUS_SUCCESS (0x00000000)
    URB Function: URB_FUNCTION_BULK_OR_INTERRUPT_TRANSFER (0x0009)
    IRP information: 0x00, Direction: FDO -> PDO
    URB bus id: 1
    Device address: 16
    Endpoint: 0x81, Direction: IN
    URB transfer type: URB_INTERRUPT (0x01)
    Packet Data Length: 0
    [Response in: 43]
    [bInterfaceClass: HID (0x03)]

No.     Time           Source                Destination           Protocol Length Info
     41 64.026919      1.16.1                host                  USB      35     URB_INTERRUPT in

Frame 41: 35 bytes on wire (280 bits), 35 bytes captured (280 bits) on interface \\.\USBPcap1, id 0
USB URB
    [Source: 1.16.1]
    [Destination: host]
    USBPcap pseudoheader length: 27
    IRP ID: 0xffff8081ffed67a0
    IRP USBD_STATUS: USBD_STATUS_SUCCESS (0x00000000)
    URB Function: URB_FUNCTION_BULK_OR_INTERRUPT_TRANSFER (0x0009)
    IRP information: 0x01, Direction: PDO -> FDO
    URB bus id: 1
    Device address: 16
    Endpoint: 0x81, Direction: IN
    URB transfer type: URB_INTERRUPT (0x01)
    Packet Data Length: 8
    [Request in: 38]
    [Time from request: 1.399964000 seconds]
    [bInterfaceClass: HID (0x03)]
HID Data: 0000000000000000
    .... ...0 = Key: LeftControl (0xe0): UP
    .... ..0. = Key: LeftShift (0xe1): UP
    .... .0.. = Key: LeftAlt (0xe2): UP
    .... 0... = Key: LeftGUI (0xe3): UP
    ...0 .... = Key: RightControl (0xe4): UP
    ..0. .... = Key: RightShift (0xe5): UP
    .0.. .... = Key: RightAlt (0xe6): UP
    0... .... = Key: RightGUI (0xe7): UP
    Padding: 00
    Array: 000000000000
        0000 0000 = Usage: Reserved (no event indicated) (0x0007, 0x0000)
        0000 0000 = Usage: Reserved (no event indicated) (0x0007, 0x0000)
        0000 0000 = Usage: Reserved (no event indicated) (0x0007, 0x0000)
        0000 0000 = Usage: Reserved (no event indicated) (0x0007, 0x0000)
        0000 0000 = Usage: Reserved (no event indicated) (0x0007, 0x0000)
        0000 0000 = Usage: Reserved (no event indicated) (0x0007, 0x0000)

No.     Time           Source                Destination           Protocol Length Info
     42 64.026954      host                  1.16.1                USB      27     URB_INTERRUPT in

Frame 42: 27 bytes on wire (216 bits), 27 bytes captured (216 bits) on interface \\.\USBPcap1, id 0
USB URB
    [Source: host]
    [Destination: 1.16.1]
    USBPcap pseudoheader length: 27
    IRP ID: 0xffff8081ffed67a0
    IRP USBD_STATUS: USBD_STATUS_SUCCESS (0x00000000)
    URB Function: URB_FUNCTION_BULK_OR_INTERRUPT_TRANSFER (0x0009)
    IRP information: 0x00, Direction: FDO -> PDO
    URB bus id: 1
    Device address: 16
    Endpoint: 0x81, Direction: IN
    URB transfer type: URB_INTERRUPT (0x01)
    Packet Data Length: 0
    [Response in: 45]
    [bInterfaceClass: HID (0x03)]

No.     Time           Source                Destination           Protocol Length Info
     43 65.674907      1.16.1                host                  USB      35     URB_INTERRUPT in

Frame 43: 35 bytes on wire (280 bits), 35 bytes captured (280 bits) on interface \\.\USBPcap1, id 0
USB URB
    [Source: 1.16.1]
    [Destination: host]
    USBPcap pseudoheader length: 27
    IRP ID: 0xffff8082152e77a0
    IRP USBD_STATUS: USBD_STATUS_SUCCESS (0x00000000)
    URB Function: URB_FUNCTION_BULK_OR_INTERRUPT_TRANSFER (0x0009)
    IRP information: 0x01, Direction: PDO -> FDO
    URB bus id: 1
    Device address: 16
    Endpoint: 0x81, Direction: IN
    URB transfer type: URB_INTERRUPT (0x01)
    Packet Data Length: 8
    [Request in: 40]
    [Time from request: 1.655966000 seconds]
    [bInterfaceClass: HID (0x03)]
HID Data: 0000070000000000
    .... ...0 = Key: LeftControl (0xe0): UP
    .... ..0. = Key: LeftShift (0xe1): UP
    .... .0.. = Key: LeftAlt (0xe2): UP
    .... 0... = Key: LeftGUI (0xe3): UP
    ...0 .... = Key: RightControl (0xe4): UP
    ..0. .... = Key: RightShift (0xe5): UP
    .0.. .... = Key: RightAlt (0xe6): UP
    0... .... = Key: RightGUI (0xe7): UP
    Padding: 00
    Array: 070000000000
        0000 0111 = Usage: Keyboard d and D (0x0007, 0x0007)
        0000 0000 = Usage: Reserved (no event indicated) (0x0007, 0x0000)
        0000 0000 = Usage: Reserved (no event indicated) (0x0007, 0x0000)
        0000 0000 = Usage: Reserved (no event indicated) (0x0007, 0x0000)
        0000 0000 = Usage: Reserved (no event indicated) (0x0007, 0x0000)
        0000 0000 = Usage: Reserved (no event indicated) (0x0007, 0x0000)

No.     Time           Source                Destination           Protocol Length Info
     44 65.674937      host                  1.16.1                USB      27     URB_INTERRUPT in

Frame 44: 27 bytes on wire (216 bits), 27 bytes captured (216 bits) on interface \\.\USBPcap1, id 0
USB URB
    [Source: host]
    [Destination: 1.16.1]
    USBPcap pseudoheader length: 27
    IRP ID: 0xffff8082152e77a0
    IRP USBD_STATUS: USBD_STATUS_SUCCESS (0x00000000)
    URB Function: URB_FUNCTION_BULK_OR_INTERRUPT_TRANSFER (0x0009)
    IRP information: 0x00, Direction: FDO -> PDO
    URB bus id: 1
    Device address: 16
    Endpoint: 0x81, Direction: IN
    URB transfer type: URB_INTERRUPT (0x01)
    Packet Data Length: 0
    [Response in: 47]
    [bInterfaceClass: HID (0x03)]

No.     Time           Source                Destination           Protocol Length Info
     45 65.682917      1.16.1                host                  USB      35     URB_INTERRUPT in

Frame 45: 35 bytes on wire (280 bits), 35 bytes captured (280 bits) on interface \\.\USBPcap1, id 0
USB URB
    [Source: 1.16.1]
    [Destination: host]
    USBPcap pseudoheader length: 27
    IRP ID: 0xffff8081ffed67a0
    IRP USBD_STATUS: USBD_STATUS_SUCCESS (0x00000000)
    URB Function: URB_FUNCTION_BULK_OR_INTERRUPT_TRANSFER (0x0009)
    IRP information: 0x01, Direction: PDO -> FDO
    URB bus id: 1
    Device address: 16
    Endpoint: 0x81, Direction: IN
    URB transfer type: URB_INTERRUPT (0x01)
    Packet Data Length: 8
    [Request in: 42]
    [Time from request: 1.655963000 seconds]
    [bInterfaceClass: HID (0x03)]
HID Data: 0000000000000000
    .... ...0 = Key: LeftControl (0xe0): UP
    .... ..0. = Key: LeftShift (0xe1): UP
    .... .0.. = Key: LeftAlt (0xe2): UP
    .... 0... = Key: LeftGUI (0xe3): UP
    ...0 .... = Key: RightControl (0xe4): UP
    ..0. .... = Key: RightShift (0xe5): UP
    .0.. .... = Key: RightAlt (0xe6): UP
    0... .... = Key: RightGUI (0xe7): UP
    Padding: 00
    Array: 000000000000
        0000 0000 = Usage: Reserved (no event indicated) (0x0007, 0x0000)
        0000 0000 = Usage: Reserved (no event indicated) (0x0007, 0x0000)
        0000 0000 = Usage: Reserved (no event indicated) (0x0007, 0x0000)
        0000 0000 = Usage: Reserved (no event indicated) (0x0007, 0x0000)
        0000 0000 = Usage: Reserved (no event indicated) (0x0007, 0x0000)
        0000 0000 = Usage: Reserved (no event indicated) (0x0007, 0x0000)

No.     Time           Source                Destination           Protocol Length Info
     46 65.682955      host                  1.16.1                USB      27     URB_INTERRUPT in

Frame 46: 27 bytes on wire (216 bits), 27 bytes captured (216 bits) on interface \\.\USBPcap1, id 0
USB URB
    [Source: host]
    [Destination: 1.16.1]
    USBPcap pseudoheader length: 27
    IRP ID: 0xffff8081ffed67a0
    IRP USBD_STATUS: USBD_STATUS_SUCCESS (0x00000000)
    URB Function: URB_FUNCTION_BULK_OR_INTERRUPT_TRANSFER (0x0009)
    IRP information: 0x00, Direction: FDO -> PDO
    URB bus id: 1
    Device address: 16
    Endpoint: 0x81, Direction: IN
    URB transfer type: URB_INTERRUPT (0x01)
    Packet Data Length: 0
    [Response in: 49]
    [bInterfaceClass: HID (0x03)]

No.     Time           Source                Destination           Protocol Length Info
     47 82.874924      1.16.1                host                  USB      35     URB_INTERRUPT in

Frame 47: 35 bytes on wire (280 bits), 35 bytes captured (280 bits) on interface \\.\USBPcap1, id 0
USB URB
    [Source: 1.16.1]
    [Destination: host]
    USBPcap pseudoheader length: 27
    IRP ID: 0xffff8082152e77a0
    IRP USBD_STATUS: USBD_STATUS_SUCCESS (0x00000000)
    URB Function: URB_FUNCTION_BULK_OR_INTERRUPT_TRANSFER (0x0009)
    IRP information: 0x01, Direction: PDO -> FDO
    URB bus id: 1
    Device address: 16
    Endpoint: 0x81, Direction: IN
    URB transfer type: URB_INTERRUPT (0x01)
    Packet Data Length: 8
    [Request in: 44]
    [Time from request: 17.199987000 seconds]
    [bInterfaceClass: HID (0x03)]
HID Data: 0000280000000000
    .... ...0 = Key: LeftControl (0xe0): UP
    .... ..0. = Key: LeftShift (0xe1): UP
    .... .0.. = Key: LeftAlt (0xe2): UP
    .... 0... = Key: LeftGUI (0xe3): UP
    ...0 .... = Key: RightControl (0xe4): UP
    ..0. .... = Key: RightShift (0xe5): UP
    .0.. .... = Key: RightAlt (0xe6): UP
    0... .... = Key: RightGUI (0xe7): UP
    Padding: 00
    Array: 280000000000
        0010 1000 = Usage: Keyboard Return (ENTER) (0x0007, 0x0028)
        0000 0000 = Usage: Reserved (no event indicated) (0x0007, 0x0000)
        0000 0000 = Usage: Reserved (no event indicated) (0x0007, 0x0000)
        0000 0000 = Usage: Reserved (no event indicated) (0x0007, 0x0000)
        0000 0000 = Usage: Reserved (no event indicated) (0x0007, 0x0000)
        0000 0000 = Usage: Reserved (no event indicated) (0x0007, 0x0000)

No.     Time           Source                Destination           Protocol Length Info
     48 82.874961      host                  1.16.1                USB      27     URB_INTERRUPT in

Frame 48: 27 bytes on wire (216 bits), 27 bytes captured (216 bits) on interface \\.\USBPcap1, id 0
USB URB
    [Source: host]
    [Destination: 1.16.1]
    USBPcap pseudoheader length: 27
    IRP ID: 0xffff8082152e77a0
    IRP USBD_STATUS: USBD_STATUS_SUCCESS (0x00000000)
    URB Function: URB_FUNCTION_BULK_OR_INTERRUPT_TRANSFER (0x0009)
    IRP information: 0x00, Direction: FDO -> PDO
    URB bus id: 1
    Device address: 16
    Endpoint: 0x81, Direction: IN
    URB transfer type: URB_INTERRUPT (0x01)
    Packet Data Length: 0
    [Response in: 51]
    [bInterfaceClass: HID (0x03)]

No.     Time           Source                Destination           Protocol Length Info
     49 82.882938      1.16.1                host                  USB      35     URB_INTERRUPT in

Frame 49: 35 bytes on wire (280 bits), 35 bytes captured (280 bits) on interface \\.\USBPcap1, id 0
USB URB
    [Source: 1.16.1]
    [Destination: host]
    USBPcap pseudoheader length: 27
    IRP ID: 0xffff8081ffed67a0
    IRP USBD_STATUS: USBD_STATUS_SUCCESS (0x00000000)
    URB Function: URB_FUNCTION_BULK_OR_INTERRUPT_TRANSFER (0x0009)
    IRP information: 0x01, Direction: PDO -> FDO
    URB bus id: 1
    Device address: 16
    Endpoint: 0x81, Direction: IN
    URB transfer type: URB_INTERRUPT (0x01)
    Packet Data Length: 8
    [Request in: 46]
    [Time from request: 17.199983000 seconds]
    [bInterfaceClass: HID (0x03)]
HID Data: 0000000000000000
    .... ...0 = Key: LeftControl (0xe0): UP
    .... ..0. = Key: LeftShift (0xe1): UP
    .... .0.. = Key: LeftAlt (0xe2): UP
    .... 0... = Key: LeftGUI (0xe3): UP
    ...0 .... = Key: RightControl (0xe4): UP
    ..0. .... = Key: RightShift (0xe5): UP
    .0.. .... = Key: RightAlt (0xe6): UP
    0... .... = Key: RightGUI (0xe7): UP
    Padding: 00
    Array: 000000000000
        0000 0000 = Usage: Reserved (no event indicated) (0x0007, 0x0000)
        0000 0000 = Usage: Reserved (no event indicated) (0x0007, 0x0000)
        0000 0000 = Usage: Reserved (no event indicated) (0x0007, 0x0000)
        0000 0000 = Usage: Reserved (no event indicated) (0x0007, 0x0000)
        0000 0000 = Usage: Reserved (no event indicated) (0x0007, 0x0000)
        0000 0000 = Usage: Reserved (no event indicated) (0x0007, 0x0000)

No.     Time           Source                Destination           Protocol Length Info
     50 82.882990      host                  1.16.1                USB      27     URB_INTERRUPT in

Frame 50: 27 bytes on wire (216 bits), 27 bytes captured (216 bits) on interface \\.\USBPcap1, id 0
USB URB
    [Source: host]
    [Destination: 1.16.1]
    USBPcap pseudoheader length: 27
    IRP ID: 0xffff8081ffed67a0
    IRP USBD_STATUS: USBD_STATUS_SUCCESS (0x00000000)
    URB Function: URB_FUNCTION_BULK_OR_INTERRUPT_TRANSFER (0x0009)
    IRP information: 0x00, Direction: FDO -> PDO
    URB bus id: 1
    Device address: 16
    Endpoint: 0x81, Direction: IN
    URB transfer type: URB_INTERRUPT (0x01)
    Packet Data Length: 0
    [Response in: 53]
    [bInterfaceClass: HID (0x03)]

No.     Time           Source                Destination           Protocol Length Info
     51 83.074928      1.16.1                host                  USB      35     URB_INTERRUPT in

Frame 51: 35 bytes on wire (280 bits), 35 bytes captured (280 bits) on interface \\.\USBPcap1, id 0
USB URB
    [Source: 1.16.1]
    [Destination: host]
    USBPcap pseudoheader length: 27
    IRP ID: 0xffff8082152e77a0
    IRP USBD_STATUS: USBD_STATUS_SUCCESS (0x00000000)
    URB Function: URB_FUNCTION_BULK_OR_INTERRUPT_TRANSFER (0x0009)
    IRP information: 0x01, Direction: PDO -> FDO
    URB bus id: 1
    Device address: 16
    Endpoint: 0x81, Direction: IN
    URB transfer type: URB_INTERRUPT (0x01)
    Packet Data Length: 8
    [Request in: 48]
    [Time from request: 0.199967000 seconds]
    [bInterfaceClass: HID (0x03)]
HID Data: 0000280000000000
    .... ...0 = Key: LeftControl (0xe0): UP
    .... ..0. = Key: LeftShift (0xe1): UP
    .... .0.. = Key: LeftAlt (0xe2): UP
    .... 0... = Key: LeftGUI (0xe3): UP
    ...0 .... = Key: RightControl (0xe4): UP
    ..0. .... = Key: RightShift (0xe5): UP
    .0.. .... = Key: RightAlt (0xe6): UP
    0... .... = Key: RightGUI (0xe7): UP
    Padding: 00
    Array: 280000000000
        0010 1000 = Usage: Keyboard Return (ENTER) (0x0007, 0x0028)
        0000 0000 = Usage: Reserved (no event indicated) (0x0007, 0x0000)
        0000 0000 = Usage: Reserved (no event indicated) (0x0007, 0x0000)
        0000 0000 = Usage: Reserved (no event indicated) (0x0007, 0x0000)
        0000 0000 = Usage: Reserved (no event indicated) (0x0007, 0x0000)
        0000 0000 = Usage: Reserved (no event indicated) (0x0007, 0x0000)

No.     Time           Source                Destination           Protocol Length Info
     52 83.074959      host                  1.16.1                USB      27     URB_INTERRUPT in

Frame 52: 27 bytes on wire (216 bits), 27 bytes captured (216 bits) on interface \\.\USBPcap1, id 0
USB URB
    [Source: host]
    [Destination: 1.16.1]
    USBPcap pseudoheader length: 27
    IRP ID: 0xffff8082152e77a0
    IRP USBD_STATUS: USBD_STATUS_SUCCESS (0x00000000)
    URB Function: URB_FUNCTION_BULK_OR_INTERRUPT_TRANSFER (0x0009)
    IRP information: 0x00, Direction: FDO -> PDO
    URB bus id: 1
    Device address: 16
    Endpoint: 0x81, Direction: IN
    URB transfer type: URB_INTERRUPT (0x01)
    Packet Data Length: 0
    [Response in: 55]
    [bInterfaceClass: HID (0x03)]

No.     Time           Source                Destination           Protocol Length Info
     53 83.082993      1.16.1                host                  USB      35     URB_INTERRUPT in

Frame 53: 35 bytes on wire (280 bits), 35 bytes captured (280 bits) on interface \\.\USBPcap1, id 0
USB URB
    [Source: 1.16.1]
    [Destination: host]
    USBPcap pseudoheader length: 27
    IRP ID: 0xffff8081ffed67a0
    IRP USBD_STATUS: USBD_STATUS_SUCCESS (0x00000000)
    URB Function: URB_FUNCTION_BULK_OR_INTERRUPT_TRANSFER (0x0009)
    IRP information: 0x01, Direction: PDO -> FDO
    URB bus id: 1
    Device address: 16
    Endpoint: 0x81, Direction: IN
    URB transfer type: URB_INTERRUPT (0x01)
    Packet Data Length: 8
    [Request in: 50]
    [Time from request: 0.200003000 seconds]
    [bInterfaceClass: HID (0x03)]
HID Data: 0000000000000000
    .... ...0 = Key: LeftControl (0xe0): UP
    .... ..0. = Key: LeftShift (0xe1): UP
    .... .0.. = Key: LeftAlt (0xe2): UP
    .... 0... = Key: LeftGUI (0xe3): UP
    ...0 .... = Key: RightControl (0xe4): UP
    ..0. .... = Key: RightShift (0xe5): UP
    .0.. .... = Key: RightAlt (0xe6): UP
    0... .... = Key: RightGUI (0xe7): UP
    Padding: 00
    Array: 000000000000
        0000 0000 = Usage: Reserved (no event indicated) (0x0007, 0x0000)
        0000 0000 = Usage: Reserved (no event indicated) (0x0007, 0x0000)
        0000 0000 = Usage: Reserved (no event indicated) (0x0007, 0x0000)
        0000 0000 = Usage: Reserved (no event indicated) (0x0007, 0x0000)
        0000 0000 = Usage: Reserved (no event indicated) (0x0007, 0x0000)
        0000 0000 = Usage: Reserved (no event indicated) (0x0007, 0x0000)

No.     Time           Source                Destination           Protocol Length Info
     54 83.083033      host                  1.16.1                USB      27     URB_INTERRUPT in

Frame 54: 27 bytes on wire (216 bits), 27 bytes captured (216 bits) on interface \\.\USBPcap1, id 0
USB URB
    [Source: host]
    [Destination: 1.16.1]
    USBPcap pseudoheader length: 27
    IRP ID: 0xffff8081ffed67a0
    IRP USBD_STATUS: USBD_STATUS_SUCCESS (0x00000000)
    URB Function: URB_FUNCTION_BULK_OR_INTERRUPT_TRANSFER (0x0009)
    IRP information: 0x00, Direction: FDO -> PDO
    URB bus id: 1
    Device address: 16
    Endpoint: 0x81, Direction: IN
    URB transfer type: URB_INTERRUPT (0x01)
    Packet Data Length: 0
    [Response in: 57]
    [bInterfaceClass: HID (0x03)]

No.     Time           Source                Destination           Protocol Length Info
     55 97.858937      1.16.1                host                  USB      35     URB_INTERRUPT in

Frame 55: 35 bytes on wire (280 bits), 35 bytes captured (280 bits) on interface \\.\USBPcap1, id 0
USB URB
    [Source: 1.16.1]
    [Destination: host]
    USBPcap pseudoheader length: 27
    IRP ID: 0xffff8082152e77a0
    IRP USBD_STATUS: USBD_STATUS_SUCCESS (0x00000000)
    URB Function: URB_FUNCTION_BULK_OR_INTERRUPT_TRANSFER (0x0009)
    IRP information: 0x01, Direction: PDO -> FDO
    URB bus id: 1
    Device address: 16
    Endpoint: 0x81, Direction: IN
    URB transfer type: URB_INTERRUPT (0x01)
    Packet Data Length: 8
    [Request in: 52]
    [Time from request: 14.783978000 seconds]
    [bInterfaceClass: HID (0x03)]
HID Data: 00002c0000000000
    .... ...0 = Key: LeftControl (0xe0): UP
    .... ..0. = Key: LeftShift (0xe1): UP
    .... .0.. = Key: LeftAlt (0xe2): UP
    .... 0... = Key: LeftGUI (0xe3): UP
    ...0 .... = Key: RightControl (0xe4): UP
    ..0. .... = Key: RightShift (0xe5): UP
    .0.. .... = Key: RightAlt (0xe6): UP
    0... .... = Key: RightGUI (0xe7): UP
    Padding: 00
    Array: 2c0000000000
        0010 1100 = Usage: Keyboard Spacebar (0x0007, 0x002c)
        0000 0000 = Usage: Reserved (no event indicated) (0x0007, 0x0000)
        0000 0000 = Usage: Reserved (no event indicated) (0x0007, 0x0000)
        0000 0000 = Usage: Reserved (no event indicated) (0x0007, 0x0000)
        0000 0000 = Usage: Reserved (no event indicated) (0x0007, 0x0000)
        0000 0000 = Usage: Reserved (no event indicated) (0x0007, 0x0000)

No.     Time           Source                Destination           Protocol Length Info
     56 97.858968      host                  1.16.1                USB      27     URB_INTERRUPT in

Frame 56: 27 bytes on wire (216 bits), 27 bytes captured (216 bits) on interface \\.\USBPcap1, id 0
USB URB
    [Source: host]
    [Destination: 1.16.1]
    USBPcap pseudoheader length: 27
    IRP ID: 0xffff8082152e77a0
    IRP USBD_STATUS: USBD_STATUS_SUCCESS (0x00000000)
    URB Function: URB_FUNCTION_BULK_OR_INTERRUPT_TRANSFER (0x0009)
    IRP information: 0x00, Direction: FDO -> PDO
    URB bus id: 1
    Device address: 16
    Endpoint: 0x81, Direction: IN
    URB transfer type: URB_INTERRUPT (0x01)
    Packet Data Length: 0
    [Response in: 59]
    [bInterfaceClass: HID (0x03)]

No.     Time           Source                Destination           Protocol Length Info
     57 97.866941      1.16.1                host                  USB      35     URB_INTERRUPT in

Frame 57: 35 bytes on wire (280 bits), 35 bytes captured (280 bits) on interface \\.\USBPcap1, id 0
USB URB
    [Source: 1.16.1]
    [Destination: host]
    USBPcap pseudoheader length: 27
    IRP ID: 0xffff8081ffed67a0
    IRP USBD_STATUS: USBD_STATUS_SUCCESS (0x00000000)
    URB Function: URB_FUNCTION_BULK_OR_INTERRUPT_TRANSFER (0x0009)
    IRP information: 0x01, Direction: PDO -> FDO
    URB bus id: 1
    Device address: 16
    Endpoint: 0x81, Direction: IN
    URB transfer type: URB_INTERRUPT (0x01)
    Packet Data Length: 8
    [Request in: 54]
    [Time from request: 14.783908000 seconds]
    [bInterfaceClass: HID (0x03)]
HID Data: 0000000000000000
    .... ...0 = Key: LeftControl (0xe0): UP
    .... ..0. = Key: LeftShift (0xe1): UP
    .... .0.. = Key: LeftAlt (0xe2): UP
    .... 0... = Key: LeftGUI (0xe3): UP
    ...0 .... = Key: RightControl (0xe4): UP
    ..0. .... = Key: RightShift (0xe5): UP
    .0.. .... = Key: RightAlt (0xe6): UP
    0... .... = Key: RightGUI (0xe7): UP
    Padding: 00
    Array: 000000000000
        0000 0000 = Usage: Reserved (no event indicated) (0x0007, 0x0000)
        0000 0000 = Usage: Reserved (no event indicated) (0x0007, 0x0000)
        0000 0000 = Usage: Reserved (no event indicated) (0x0007, 0x0000)
        0000 0000 = Usage: Reserved (no event indicated) (0x0007, 0x0000)
        0000 0000 = Usage: Reserved (no event indicated) (0x0007, 0x0000)
        0000 0000 = Usage: Reserved (no event indicated) (0x0007, 0x0000)

No.     Time           Source                Destination           Protocol Length Info
     58 97.866995      host                  1.16.1                USB      27     URB_INTERRUPT in

Frame 58: 27 bytes on wire (216 bits), 27 bytes captured (216 bits) on interface \\.\USBPcap1, id 0
USB URB
    [Source: host]
    [Destination: 1.16.1]
    USBPcap pseudoheader length: 27
    IRP ID: 0xffff8081ffed67a0
    IRP USBD_STATUS: USBD_STATUS_SUCCESS (0x00000000)
    URB Function: URB_FUNCTION_BULK_OR_INTERRUPT_TRANSFER (0x0009)
    IRP information: 0x00, Direction: FDO -> PDO
    URB bus id: 1
    Device address: 16
    Endpoint: 0x81, Direction: IN
    URB transfer type: URB_INTERRUPT (0x01)
    Packet Data Length: 0
    [Response in: 61]
    [bInterfaceClass: HID (0x03)]

No.     Time           Source                Destination           Protocol Length Info
     59 100.642944     1.16.1                host                  USB      35     URB_INTERRUPT in

Frame 59: 35 bytes on wire (280 bits), 35 bytes captured (280 bits) on interface \\.\USBPcap1, id 0
USB URB
    [Source: 1.16.1]
    [Destination: host]
    USBPcap pseudoheader length: 27
    IRP ID: 0xffff8082152e77a0
    IRP USBD_STATUS: USBD_STATUS_SUCCESS (0x00000000)
    URB Function: URB_FUNCTION_BULK_OR_INTERRUPT_TRANSFER (0x0009)
    IRP information: 0x01, Direction: PDO -> FDO
    URB bus id: 1
    Device address: 16
    Endpoint: 0x81, Direction: IN
    URB transfer type: URB_INTERRUPT (0x01)
    Packet Data Length: 8
    [Request in: 56]
    [Time from request: 2.783976000 seconds]
    [bInterfaceClass: HID (0x03)]
HID Data: 00002c0000000000
    .... ...0 = Key: LeftControl (0xe0): UP
    .... ..0. = Key: LeftShift (0xe1): UP
    .... .0.. = Key: LeftAlt (0xe2): UP
    .... 0... = Key: LeftGUI (0xe3): UP
    ...0 .... = Key: RightControl (0xe4): UP
    ..0. .... = Key: RightShift (0xe5): UP
    .0.. .... = Key: RightAlt (0xe6): UP
    0... .... = Key: RightGUI (0xe7): UP
    Padding: 00
    Array: 2c0000000000
        0010 1100 = Usage: Keyboard Spacebar (0x0007, 0x002c)
        0000 0000 = Usage: Reserved (no event indicated) (0x0007, 0x0000)
        0000 0000 = Usage: Reserved (no event indicated) (0x0007, 0x0000)
        0000 0000 = Usage: Reserved (no event indicated) (0x0007, 0x0000)
        0000 0000 = Usage: Reserved (no event indicated) (0x0007, 0x0000)
        0000 0000 = Usage: Reserved (no event indicated) (0x0007, 0x0000)

No.     Time           Source                Destination           Protocol Length Info
     60 100.642980     host                  1.16.1                USB      27     URB_INTERRUPT in

Frame 60: 27 bytes on wire (216 bits), 27 bytes captured (216 bits) on interface \\.\USBPcap1, id 0
USB URB
    [Source: host]
    [Destination: 1.16.1]
    USBPcap pseudoheader length: 27
    IRP ID: 0xffff8082152e77a0
    IRP USBD_STATUS: USBD_STATUS_SUCCESS (0x00000000)
    URB Function: URB_FUNCTION_BULK_OR_INTERRUPT_TRANSFER (0x0009)
    IRP information: 0x00, Direction: FDO -> PDO
    URB bus id: 1
    Device address: 16
    Endpoint: 0x81, Direction: IN
    URB transfer type: URB_INTERRUPT (0x01)
    Packet Data Length: 0
    [Response in: 63]
    [bInterfaceClass: HID (0x03)]

No.     Time           Source                Destination           Protocol Length Info
     61 100.650987     1.16.1                host                  USB      35     URB_INTERRUPT in

Frame 61: 35 bytes on wire (280 bits), 35 bytes captured (280 bits) on interface \\.\USBPcap1, id 0
USB URB
    [Source: 1.16.1]
    [Destination: host]
    USBPcap pseudoheader length: 27
    IRP ID: 0xffff8081ffed67a0
    IRP USBD_STATUS: USBD_STATUS_SUCCESS (0x00000000)
    URB Function: URB_FUNCTION_BULK_OR_INTERRUPT_TRANSFER (0x0009)
    IRP information: 0x01, Direction: PDO -> FDO
    URB bus id: 1
    Device address: 16
    Endpoint: 0x81, Direction: IN
    URB transfer type: URB_INTERRUPT (0x01)
    Packet Data Length: 8
    [Request in: 58]
    [Time from request: 2.783992000 seconds]
    [bInterfaceClass: HID (0x03)]
HID Data: 0000000000000000
    .... ...0 = Key: LeftControl (0xe0): UP
    .... ..0. = Key: LeftShift (0xe1): UP
    .... .0.. = Key: LeftAlt (0xe2): UP
    .... 0... = Key: LeftGUI (0xe3): UP
    ...0 .... = Key: RightControl (0xe4): UP
    ..0. .... = Key: RightShift (0xe5): UP
    .0.. .... = Key: RightAlt (0xe6): UP
    0... .... = Key: RightGUI (0xe7): UP
    Padding: 00
    Array: 000000000000
        0000 0000 = Usage: Reserved (no event indicated) (0x0007, 0x0000)
        0000 0000 = Usage: Reserved (no event indicated) (0x0007, 0x0000)
        0000 0000 = Usage: Reserved (no event indicated) (0x0007, 0x0000)
        0000 0000 = Usage: Reserved (no event indicated) (0x0007, 0x0000)
        0000 0000 = Usage: Reserved (no event indicated) (0x0007, 0x0000)
        0000 0000 = Usage: Reserved (no event indicated) (0x0007, 0x0000)

No.     Time           Source                Destination           Protocol Length Info
     62 100.651044     host                  1.16.1                USB      27     URB_INTERRUPT in

Frame 62: 27 bytes on wire (216 bits), 27 bytes captured (216 bits) on interface \\.\USBPcap1, id 0
USB URB
    [Source: host]
    [Destination: 1.16.1]
    USBPcap pseudoheader length: 27
    IRP ID: 0xffff8081ffed67a0
    IRP USBD_STATUS: USBD_STATUS_SUCCESS (0x00000000)
    URB Function: URB_FUNCTION_BULK_OR_INTERRUPT_TRANSFER (0x0009)
    IRP information: 0x00, Direction: FDO -> PDO
    URB bus id: 1
    Device address: 16
    Endpoint: 0x81, Direction: IN
    URB transfer type: URB_INTERRUPT (0x01)
    Packet Data Length: 0
    [Response in: 65]
    [bInterfaceClass: HID (0x03)]

No.     Time           Source                Destination           Protocol Length Info
     63 101.474941     1.16.1                host                  USB      35     URB_INTERRUPT in

Frame 63: 35 bytes on wire (280 bits), 35 bytes captured (280 bits) on interface \\.\USBPcap1, id 0
USB URB
    [Source: 1.16.1]
    [Destination: host]
    USBPcap pseudoheader length: 27
    IRP ID: 0xffff8082152e77a0
    IRP USBD_STATUS: USBD_STATUS_SUCCESS (0x00000000)
    URB Function: URB_FUNCTION_BULK_OR_INTERRUPT_TRANSFER (0x0009)
    IRP information: 0x01, Direction: PDO -> FDO
    URB bus id: 1
    Device address: 16
    Endpoint: 0x81, Direction: IN
    URB transfer type: URB_INTERRUPT (0x01)
    Packet Data Length: 8
    [Request in: 60]
    [Time from request: 0.831961000 seconds]
    [bInterfaceClass: HID (0x03)]
HID Data: 00002c0000000000
    .... ...0 = Key: LeftControl (0xe0): UP
    .... ..0. = Key: LeftShift (0xe1): UP
    .... .0.. = Key: LeftAlt (0xe2): UP
    .... 0... = Key: LeftGUI (0xe3): UP
    ...0 .... = Key: RightControl (0xe4): UP
    ..0. .... = Key: RightShift (0xe5): UP
    .0.. .... = Key: RightAlt (0xe6): UP
    0... .... = Key: RightGUI (0xe7): UP
    Padding: 00
    Array: 2c0000000000
        0010 1100 = Usage: Keyboard Spacebar (0x0007, 0x002c)
        0000 0000 = Usage: Reserved (no event indicated) (0x0007, 0x0000)
        0000 0000 = Usage: Reserved (no event indicated) (0x0007, 0x0000)
        0000 0000 = Usage: Reserved (no event indicated) (0x0007, 0x0000)
        0000 0000 = Usage: Reserved (no event indicated) (0x0007, 0x0000)
        0000 0000 = Usage: Reserved (no event indicated) (0x0007, 0x0000)

No.     Time           Source                Destination           Protocol Length Info
     64 101.474979     host                  1.16.1                USB      27     URB_INTERRUPT in

Frame 64: 27 bytes on wire (216 bits), 27 bytes captured (216 bits) on interface \\.\USBPcap1, id 0
USB URB
    [Source: host]
    [Destination: 1.16.1]
    USBPcap pseudoheader length: 27
    IRP ID: 0xffff8082152e77a0
    IRP USBD_STATUS: USBD_STATUS_SUCCESS (0x00000000)
    URB Function: URB_FUNCTION_BULK_OR_INTERRUPT_TRANSFER (0x0009)
    IRP information: 0x00, Direction: FDO -> PDO
    URB bus id: 1
    Device address: 16
    Endpoint: 0x81, Direction: IN
    URB transfer type: URB_INTERRUPT (0x01)
    Packet Data Length: 0
    [Response in: 67]
    [bInterfaceClass: HID (0x03)]

No.     Time           Source                Destination           Protocol Length Info
     65 101.483153     1.16.1                host                  USB      35     URB_INTERRUPT in

Frame 65: 35 bytes on wire (280 bits), 35 bytes captured (280 bits) on interface \\.\USBPcap1, id 0
USB URB
    [Source: 1.16.1]
    [Destination: host]
    USBPcap pseudoheader length: 27
    IRP ID: 0xffff8081ffed67a0
    IRP USBD_STATUS: USBD_STATUS_SUCCESS (0x00000000)
    URB Function: URB_FUNCTION_BULK_OR_INTERRUPT_TRANSFER (0x0009)
    IRP information: 0x01, Direction: PDO -> FDO
    URB bus id: 1
    Device address: 16
    Endpoint: 0x81, Direction: IN
    URB transfer type: URB_INTERRUPT (0x01)
    Packet Data Length: 8
    [Request in: 62]
    [Time from request: 0.832109000 seconds]
    [bInterfaceClass: HID (0x03)]
HID Data: 0000000000000000
    .... ...0 = Key: LeftControl (0xe0): UP
    .... ..0. = Key: LeftShift (0xe1): UP
    .... .0.. = Key: LeftAlt (0xe2): UP
    .... 0... = Key: LeftGUI (0xe3): UP
    ...0 .... = Key: RightControl (0xe4): UP
    ..0. .... = Key: RightShift (0xe5): UP
    .0.. .... = Key: RightAlt (0xe6): UP
    0... .... = Key: RightGUI (0xe7): UP
    Padding: 00
    Array: 000000000000
        0000 0000 = Usage: Reserved (no event indicated) (0x0007, 0x0000)
        0000 0000 = Usage: Reserved (no event indicated) (0x0007, 0x0000)
        0000 0000 = Usage: Reserved (no event indicated) (0x0007, 0x0000)
        0000 0000 = Usage: Reserved (no event indicated) (0x0007, 0x0000)
        0000 0000 = Usage: Reserved (no event indicated) (0x0007, 0x0000)
        0000 0000 = Usage: Reserved (no event indicated) (0x0007, 0x0000)

No.     Time           Source                Destination           Protocol Length Info
     66 101.483227     host                  1.16.1                USB      27     URB_INTERRUPT in

Frame 66: 27 bytes on wire (216 bits), 27 bytes captured (216 bits) on interface \\.\USBPcap1, id 0
USB URB
    [Source: host]
    [Destination: 1.16.1]
    USBPcap pseudoheader length: 27
    IRP ID: 0xffff8081ffed67a0
    IRP USBD_STATUS: USBD_STATUS_SUCCESS (0x00000000)
    URB Function: URB_FUNCTION_BULK_OR_INTERRUPT_TRANSFER (0x0009)
    IRP information: 0x00, Direction: FDO -> PDO
    URB bus id: 1
    Device address: 16
    Endpoint: 0x81, Direction: IN
    URB transfer type: URB_INTERRUPT (0x01)
    Packet Data Length: 0
    [Response in: 69]
    [bInterfaceClass: HID (0x03)]

No.     Time           Source                Destination           Protocol Length Info
     67 103.066939     1.16.1                host                  USB      35     URB_INTERRUPT in

Frame 67: 35 bytes on wire (280 bits), 35 bytes captured (280 bits) on interface \\.\USBPcap1, id 0
USB URB
    [Source: 1.16.1]
    [Destination: host]
    USBPcap pseudoheader length: 27
    IRP ID: 0xffff8082152e77a0
    IRP USBD_STATUS: USBD_STATUS_SUCCESS (0x00000000)
    URB Function: URB_FUNCTION_BULK_OR_INTERRUPT_TRANSFER (0x0009)
    IRP information: 0x01, Direction: PDO -> FDO
    URB bus id: 1
    Device address: 16
    Endpoint: 0x81, Direction: IN
    URB transfer type: URB_INTERRUPT (0x01)
    Packet Data Length: 8
    [Request in: 64]
    [Time from request: 1.591960000 seconds]
    [bInterfaceClass: HID (0x03)]
HID Data: 00002a0000000000
    .... ...0 = Key: LeftControl (0xe0): UP
    .... ..0. = Key: LeftShift (0xe1): UP
    .... .0.. = Key: LeftAlt (0xe2): UP
    .... 0... = Key: LeftGUI (0xe3): UP
    ...0 .... = Key: RightControl (0xe4): UP
    ..0. .... = Key: RightShift (0xe5): UP
    .0.. .... = Key: RightAlt (0xe6): UP
    0... .... = Key: RightGUI (0xe7): UP
    Padding: 00
    Array: 2a0000000000
        0010 1010 = Usage: Keyboard DELETE (Backspace) (0x0007, 0x002a)
        0000 0000 = Usage: Reserved (no event indicated) (0x0007, 0x0000)
        0000 0000 = Usage: Reserved (no event indicated) (0x0007, 0x0000)
        0000 0000 = Usage: Reserved (no event indicated) (0x0007, 0x0000)
        0000 0000 = Usage: Reserved (no event indicated) (0x0007, 0x0000)
        0000 0000 = Usage: Reserved (no event indicated) (0x0007, 0x0000)

No.     Time           Source                Destination           Protocol Length Info
     68 103.066969     host                  1.16.1                USB      27     URB_INTERRUPT in

Frame 68: 27 bytes on wire (216 bits), 27 bytes captured (216 bits) on interface \\.\USBPcap1, id 0
USB URB
    [Source: host]
    [Destination: 1.16.1]
    USBPcap pseudoheader length: 27
    IRP ID: 0xffff8082152e77a0
    IRP USBD_STATUS: USBD_STATUS_SUCCESS (0x00000000)
    URB Function: URB_FUNCTION_BULK_OR_INTERRUPT_TRANSFER (0x0009)
    IRP information: 0x00, Direction: FDO -> PDO
    URB bus id: 1
    Device address: 16
    Endpoint: 0x81, Direction: IN
    URB transfer type: URB_INTERRUPT (0x01)
    Packet Data Length: 0
    [Response in: 71]
    [bInterfaceClass: HID (0x03)]

No.     Time           Source                Destination           Protocol Length Info
     69 103.074950     1.16.1                host                  USB      35     URB_INTERRUPT in

Frame 69: 35 bytes on wire (280 bits), 35 bytes captured (280 bits) on interface \\.\USBPcap1, id 0
USB URB
    [Source: 1.16.1]
    [Destination: host]
    USBPcap pseudoheader length: 27
    IRP ID: 0xffff8081ffed67a0
    IRP USBD_STATUS: USBD_STATUS_SUCCESS (0x00000000)
    URB Function: URB_FUNCTION_BULK_OR_INTERRUPT_TRANSFER (0x0009)
    IRP information: 0x01, Direction: PDO -> FDO
    URB bus id: 1
    Device address: 16
    Endpoint: 0x81, Direction: IN
    URB transfer type: URB_INTERRUPT (0x01)
    Packet Data Length: 8
    [Request in: 66]
    [Time from request: 1.591723000 seconds]
    [bInterfaceClass: HID (0x03)]
HID Data: 0000000000000000
    .... ...0 = Key: LeftControl (0xe0): UP
    .... ..0. = Key: LeftShift (0xe1): UP
    .... .0.. = Key: LeftAlt (0xe2): UP
    .... 0... = Key: LeftGUI (0xe3): UP
    ...0 .... = Key: RightControl (0xe4): UP
    ..0. .... = Key: RightShift (0xe5): UP
    .0.. .... = Key: RightAlt (0xe6): UP
    0... .... = Key: RightGUI (0xe7): UP
    Padding: 00
    Array: 000000000000
        0000 0000 = Usage: Reserved (no event indicated) (0x0007, 0x0000)
        0000 0000 = Usage: Reserved (no event indicated) (0x0007, 0x0000)
        0000 0000 = Usage: Reserved (no event indicated) (0x0007, 0x0000)
        0000 0000 = Usage: Reserved (no event indicated) (0x0007, 0x0000)
        0000 0000 = Usage: Reserved (no event indicated) (0x0007, 0x0000)
        0000 0000 = Usage: Reserved (no event indicated) (0x0007, 0x0000)

No.     Time           Source                Destination           Protocol Length Info
     70 103.074981     host                  1.16.1                USB      27     URB_INTERRUPT in

Frame 70: 27 bytes on wire (216 bits), 27 bytes captured (216 bits) on interface \\.\USBPcap1, id 0
USB URB
    [Source: host]
    [Destination: 1.16.1]
    USBPcap pseudoheader length: 27
    IRP ID: 0xffff8081ffed67a0
    IRP USBD_STATUS: USBD_STATUS_SUCCESS (0x00000000)
    URB Function: URB_FUNCTION_BULK_OR_INTERRUPT_TRANSFER (0x0009)
    IRP information: 0x00, Direction: FDO -> PDO
    URB bus id: 1
    Device address: 16
    Endpoint: 0x81, Direction: IN
    URB transfer type: URB_INTERRUPT (0x01)
    Packet Data Length: 0
    [Response in: 73]
    [bInterfaceClass: HID (0x03)]

No.     Time           Source                Destination           Protocol Length Info
     71 106.882948     1.16.1                host                  USB      35     URB_INTERRUPT in

Frame 71: 35 bytes on wire (280 bits), 35 bytes captured (280 bits) on interface \\.\USBPcap1, id 0
USB URB
    [Source: 1.16.1]
    [Destination: host]
    USBPcap pseudoheader length: 27
    IRP ID: 0xffff8082152e77a0
    IRP USBD_STATUS: USBD_STATUS_SUCCESS (0x00000000)
    URB Function: URB_FUNCTION_BULK_OR_INTERRUPT_TRANSFER (0x0009)
    IRP information: 0x01, Direction: PDO -> FDO
    URB bus id: 1
    Device address: 16
    Endpoint: 0x81, Direction: IN
    URB transfer type: URB_INTERRUPT (0x01)
    Packet Data Length: 8
    [Request in: 68]
    [Time from request: 3.815979000 seconds]
    [bInterfaceClass: HID (0x03)]
HID Data: 00002b0000000000
    .... ...0 = Key: LeftControl (0xe0): UP
    .... ..0. = Key: LeftShift (0xe1): UP
    .... .0.. = Key: LeftAlt (0xe2): UP
    .... 0... = Key: LeftGUI (0xe3): UP
    ...0 .... = Key: RightControl (0xe4): UP
    ..0. .... = Key: RightShift (0xe5): UP
    .0.. .... = Key: RightAlt (0xe6): UP
    0... .... = Key: RightGUI (0xe7): UP
    Padding: 00
    Array: 2b0000000000
        0010 1011 = Usage: Keyboard Tab (0x0007, 0x002b)
        0000 0000 = Usage: Reserved (no event indicated) (0x0007, 0x0000)
        0000 0000 = Usage: Reserved (no event indicated) (0x0007, 0x0000)
        0000 0000 = Usage: Reserved (no event indicated) (0x0007, 0x0000)
        0000 0000 = Usage: Reserved (no event indicated) (0x0007, 0x0000)
        0000 0000 = Usage: Reserved (no event indicated) (0x0007, 0x0000)

No.     Time           Source                Destination           Protocol Length Info
     72 106.883003     host                  1.16.1                USB      27     URB_INTERRUPT in

Frame 72: 27 bytes on wire (216 bits), 27 bytes captured (216 bits) on interface \\.\USBPcap1, id 0
USB URB
    [Source: host]
    [Destination: 1.16.1]
    USBPcap pseudoheader length: 27
    IRP ID: 0xffff8082152e77a0
    IRP USBD_STATUS: USBD_STATUS_SUCCESS (0x00000000)
    URB Function: URB_FUNCTION_BULK_OR_INTERRUPT_TRANSFER (0x0009)
    IRP information: 0x00, Direction: FDO -> PDO
    URB bus id: 1
    Device address: 16
    Endpoint: 0x81, Direction: IN
    URB transfer type: URB_INTERRUPT (0x01)
    Packet Data Length: 0
    [Response in: 75]
    [bInterfaceClass: HID (0x03)]

No.     Time           Source                Destination           Protocol Length Info
     73 106.890965     1.16.1                host                  USB      35     URB_INTERRUPT in

Frame 73: 35 bytes on wire (280 bits), 35 bytes captured (280 bits) on interface \\.\USBPcap1, id 0
USB URB
    [Source: 1.16.1]
    [Destination: host]
    USBPcap pseudoheader length: 27
    IRP ID: 0xffff8081ffed67a0
    IRP USBD_STATUS: USBD_STATUS_SUCCESS (0x00000000)
    URB Function: URB_FUNCTION_BULK_OR_INTERRUPT_TRANSFER (0x0009)
    IRP information: 0x01, Direction: PDO -> FDO
    URB bus id: 1
    Device address: 16
    Endpoint: 0x81, Direction: IN
    URB transfer type: URB_INTERRUPT (0x01)
    Packet Data Length: 8
    [Request in: 70]
    [Time from request: 3.815984000 seconds]
    [bInterfaceClass: HID (0x03)]
HID Data: 0000000000000000
    .... ...0 = Key: LeftControl (0xe0): UP
    .... ..0. = Key: LeftShift (0xe1): UP
    .... .0.. = Key: LeftAlt (0xe2): UP
    .... 0... = Key: LeftGUI (0xe3): UP
    ...0 .... = Key: RightControl (0xe4): UP
    ..0. .... = Key: RightShift (0xe5): UP
    .0.. .... = Key: RightAlt (0xe6): UP
    0... .... = Key: RightGUI (0xe7): UP
    Padding: 00
    Array: 000000000000
        0000 0000 = Usage: Reserved (no event indicated) (0x0007, 0x0000)
        0000 0000 = Usage: Reserved (no event indicated) (0x0007, 0x0000)
        0000 0000 = Usage: Reserved (no event indicated) (0x0007, 0x0000)
        0000 0000 = Usage: Reserved (no event indicated) (0x0007, 0x0000)
        0000 0000 = Usage: Reserved (no event indicated) (0x0007, 0x0000)
        0000 0000 = Usage: Reserved (no event indicated) (0x0007, 0x0000)

No.     Time           Source                Destination           Protocol Length Info
     74 106.891022     host                  1.16.1                USB      27     URB_INTERRUPT in

Frame 74: 27 bytes on wire (216 bits), 27 bytes captured (216 bits) on interface \\.\USBPcap1, id 0
USB URB
    [Source: host]
    [Destination: 1.16.1]
    USBPcap pseudoheader length: 27
    IRP ID: 0xffff8081ffed67a0
    IRP USBD_STATUS: USBD_STATUS_SUCCESS (0x00000000)
    URB Function: URB_FUNCTION_BULK_OR_INTERRUPT_TRANSFER (0x0009)
    IRP information: 0x00, Direction: FDO -> PDO
    URB bus id: 1
    Device address: 16
    Endpoint: 0x81, Direction: IN
    URB transfer type: URB_INTERRUPT (0x01)
    Packet Data Length: 0
    [Response in: 77]
    [bInterfaceClass: HID (0x03)]

No.     Time           Source                Destination           Protocol Length Info
     75 107.082953     1.16.1                host                  USB      35     URB_INTERRUPT in

Frame 75: 35 bytes on wire (280 bits), 35 bytes captured (280 bits) on interface \\.\USBPcap1, id 0
USB URB
    [Source: 1.16.1]
    [Destination: host]
    USBPcap pseudoheader length: 27
    IRP ID: 0xffff8082152e77a0
    IRP USBD_STATUS: USBD_STATUS_SUCCESS (0x00000000)
    URB Function: URB_FUNCTION_BULK_OR_INTERRUPT_TRANSFER (0x0009)
    IRP information: 0x01, Direction: PDO -> FDO
    URB bus id: 1
    Device address: 16
    Endpoint: 0x81, Direction: IN
    URB transfer type: URB_INTERRUPT (0x01)
    Packet Data Length: 8
    [Request in: 72]
    [Time from request: 0.199950000 seconds]
    [bInterfaceClass: HID (0x03)]
HID Data: 00002b0000000000
    .... ...0 = Key: LeftControl (0xe0): UP
    .... ..0. = Key: LeftShift (0xe1): UP
    .... .0.. = Key: LeftAlt (0xe2): UP
    .... 0... = Key: LeftGUI (0xe3): UP
    ...0 .... = Key: RightControl (0xe4): UP
    ..0. .... = Key: RightShift (0xe5): UP
    .0.. .... = Key: RightAlt (0xe6): UP
    0... .... = Key: RightGUI (0xe7): UP
    Padding: 00
    Array: 2b0000000000
        0010 1011 = Usage: Keyboard Tab (0x0007, 0x002b)
        0000 0000 = Usage: Reserved (no event indicated) (0x0007, 0x0000)
        0000 0000 = Usage: Reserved (no event indicated) (0x0007, 0x0000)
        0000 0000 = Usage: Reserved (no event indicated) (0x0007, 0x0000)
        0000 0000 = Usage: Reserved (no event indicated) (0x0007, 0x0000)
        0000 0000 = Usage: Reserved (no event indicated) (0x0007, 0x0000)

No.     Time           Source                Destination           Protocol Length Info
     76 107.083027     host                  1.16.1                USB      27     URB_INTERRUPT in

Frame 76: 27 bytes on wire (216 bits), 27 bytes captured (216 bits) on interface \\.\USBPcap1, id 0
USB URB
    [Source: host]
    [Destination: 1.16.1]
    USBPcap pseudoheader length: 27
    IRP ID: 0xffff8082152e77a0
    IRP USBD_STATUS: USBD_STATUS_SUCCESS (0x00000000)
    URB Function: URB_FUNCTION_BULK_OR_INTERRUPT_TRANSFER (0x0009)
    IRP information: 0x00, Direction: FDO -> PDO
    URB bus id: 1
    Device address: 16
    Endpoint: 0x81, Direction: IN
    URB transfer type: URB_INTERRUPT (0x01)
    Packet Data Length: 0
    [Response in: 79]
    [bInterfaceClass: HID (0x03)]

No.     Time           Source                Destination           Protocol Length Info
     77 107.090968     1.16.1                host                  USB      35     URB_INTERRUPT in

Frame 77: 35 bytes on wire (280 bits), 35 bytes captured (280 bits) on interface \\.\USBPcap1, id 0
USB URB
    [Source: 1.16.1]
    [Destination: host]
    USBPcap pseudoheader length: 27
    IRP ID: 0xffff8081ffed67a0
    IRP USBD_STATUS: USBD_STATUS_SUCCESS (0x00000000)
    URB Function: URB_FUNCTION_BULK_OR_INTERRUPT_TRANSFER (0x0009)
    IRP information: 0x01, Direction: PDO -> FDO
    URB bus id: 1
    Device address: 16
    Endpoint: 0x81, Direction: IN
    URB transfer type: URB_INTERRUPT (0x01)
    Packet Data Length: 8
    [Request in: 74]
    [Time from request: 0.199946000 seconds]
    [bInterfaceClass: HID (0x03)]
HID Data: 0000000000000000
    .... ...0 = Key: LeftControl (0xe0): UP
    .... ..0. = Key: LeftShift (0xe1): UP
    .... .0.. = Key: LeftAlt (0xe2): UP
    .... 0... = Key: LeftGUI (0xe3): UP
    ...0 .... = Key: RightControl (0xe4): UP
    ..0. .... = Key: RightShift (0xe5): UP
    .0.. .... = Key: RightAlt (0xe6): UP
    0... .... = Key: RightGUI (0xe7): UP
    Padding: 00
    Array: 000000000000
        0000 0000 = Usage: Reserved (no event indicated) (0x0007, 0x0000)
        0000 0000 = Usage: Reserved (no event indicated) (0x0007, 0x0000)
        0000 0000 = Usage: Reserved (no event indicated) (0x0007, 0x0000)
        0000 0000 = Usage: Reserved (no event indicated) (0x0007, 0x0000)
        0000 0000 = Usage: Reserved (no event indicated) (0x0007, 0x0000)
        0000 0000 = Usage: Reserved (no event indicated) (0x0007, 0x0000)

No.     Time           Source                Destination           Protocol Length Info
     78 107.091001     host                  1.16.1                USB      27     URB_INTERRUPT in

Frame 78: 27 bytes on wire (216 bits), 27 bytes captured (216 bits) on interface \\.\USBPcap1, id 0
USB URB
    [Source: host]
    [Destination: 1.16.1]
    USBPcap pseudoheader length: 27
    IRP ID: 0xffff8081ffed67a0
    IRP USBD_STATUS: USBD_STATUS_SUCCESS (0x00000000)
    URB Function: URB_FUNCTION_BULK_OR_INTERRUPT_TRANSFER (0x0009)
    IRP information: 0x00, Direction: FDO -> PDO
    URB bus id: 1
    Device address: 16
    Endpoint: 0x81, Direction: IN
    URB transfer type: URB_INTERRUPT (0x01)
    Packet Data Length: 0
    [Response in: 81]
    [bInterfaceClass: HID (0x03)]

No.     Time           Source                Destination           Protocol Length Info
     79 107.858944     1.16.1                host                  USB      35     URB_INTERRUPT in

Frame 79: 35 bytes on wire (280 bits), 35 bytes captured (280 bits) on interface \\.\USBPcap1, id 0
USB URB
    [Source: 1.16.1]
    [Destination: host]
    USBPcap pseudoheader length: 27
    IRP ID: 0xffff8082152e77a0
    IRP USBD_STATUS: USBD_STATUS_SUCCESS (0x00000000)
    URB Function: URB_FUNCTION_BULK_OR_INTERRUPT_TRANSFER (0x0009)
    IRP information: 0x01, Direction: PDO -> FDO
    URB bus id: 1
    Device address: 16
    Endpoint: 0x81, Direction: IN
    URB transfer type: URB_INTERRUPT (0x01)
    Packet Data Length: 8
    [Request in: 76]
    [Time from request: 0.775917000 seconds]
    [bInterfaceClass: HID (0x03)]
HID Data: 00002b0000000000
    .... ...0 = Key: LeftControl (0xe0): UP
    .... ..0. = Key: LeftShift (0xe1): UP
    .... .0.. = Key: LeftAlt (0xe2): UP
    .... 0... = Key: LeftGUI (0xe3): UP
    ...0 .... = Key: RightControl (0xe4): UP
    ..0. .... = Key: RightShift (0xe5): UP
    .0.. .... = Key: RightAlt (0xe6): UP
    0... .... = Key: RightGUI (0xe7): UP
    Padding: 00
    Array: 2b0000000000
        0010 1011 = Usage: Keyboard Tab (0x0007, 0x002b)
        0000 0000 = Usage: Reserved (no event indicated) (0x0007, 0x0000)
        0000 0000 = Usage: Reserved (no event indicated) (0x0007, 0x0000)
        0000 0000 = Usage: Reserved (no event indicated) (0x0007, 0x0000)
        0000 0000 = Usage: Reserved (no event indicated) (0x0007, 0x0000)
        0000 0000 = Usage: Reserved (no event indicated) (0x0007, 0x0000)

No.     Time           Source                Destination           Protocol Length Info
     80 107.858974     host                  1.16.1                USB      27     URB_INTERRUPT in

Frame 80: 27 bytes on wire (216 bits), 27 bytes captured (216 bits) on interface \\.\USBPcap1, id 0
USB URB
    [Source: host]
    [Destination: 1.16.1]
    USBPcap pseudoheader length: 27
    IRP ID: 0xffff8082152e77a0
    IRP USBD_STATUS: USBD_STATUS_SUCCESS (0x00000000)
    URB Function: URB_FUNCTION_BULK_OR_INTERRUPT_TRANSFER (0x0009)
    IRP information: 0x00, Direction: FDO -> PDO
    URB bus id: 1
    Device address: 16
    Endpoint: 0x81, Direction: IN
    URB transfer type: URB_INTERRUPT (0x01)
    Packet Data Length: 0
    [Response in: 83]
    [bInterfaceClass: HID (0x03)]

No.     Time           Source                Destination           Protocol Length Info
     81 107.866951     1.16.1                host                  USB      35     URB_INTERRUPT in

Frame 81: 35 bytes on wire (280 bits), 35 bytes captured (280 bits) on interface \\.\USBPcap1, id 0
USB URB
    [Source: 1.16.1]
    [Destination: host]
    USBPcap pseudoheader length: 27
    IRP ID: 0xffff8081ffed67a0
    IRP USBD_STATUS: USBD_STATUS_SUCCESS (0x00000000)
    URB Function: URB_FUNCTION_BULK_OR_INTERRUPT_TRANSFER (0x0009)
    IRP information: 0x01, Direction: PDO -> FDO
    URB bus id: 1
    Device address: 16
    Endpoint: 0x81, Direction: IN
    URB transfer type: URB_INTERRUPT (0x01)
    Packet Data Length: 8
    [Request in: 78]
    [Time from request: 0.775950000 seconds]
    [bInterfaceClass: HID (0x03)]
HID Data: 0000000000000000
    .... ...0 = Key: LeftControl (0xe0): UP
    .... ..0. = Key: LeftShift (0xe1): UP
    .... .0.. = Key: LeftAlt (0xe2): UP
    .... 0... = Key: LeftGUI (0xe3): UP
    ...0 .... = Key: RightControl (0xe4): UP
    ..0. .... = Key: RightShift (0xe5): UP
    .0.. .... = Key: RightAlt (0xe6): UP
    0... .... = Key: RightGUI (0xe7): UP
    Padding: 00
    Array: 000000000000
        0000 0000 = Usage: Reserved (no event indicated) (0x0007, 0x0000)
        0000 0000 = Usage: Reserved (no event indicated) (0x0007, 0x0000)
        0000 0000 = Usage: Reserved (no event indicated) (0x0007, 0x0000)
        0000 0000 = Usage: Reserved (no event indicated) (0x0007, 0x0000)
        0000 0000 = Usage: Reserved (no event indicated) (0x0007, 0x0000)
        0000 0000 = Usage: Reserved (no event indicated) (0x0007, 0x0000)

No.     Time           Source                Destination           Protocol Length Info
     82 107.866999     host                  1.16.1                USB      27     URB_INTERRUPT in

Frame 82: 27 bytes on wire (216 bits), 27 bytes captured (216 bits) on interface \\.\USBPcap1, id 0
USB URB
    [Source: host]
    [Destination: 1.16.1]
    USBPcap pseudoheader length: 27
    IRP ID: 0xffff8081ffed67a0
    IRP USBD_STATUS: USBD_STATUS_SUCCESS (0x00000000)
    URB Function: URB_FUNCTION_BULK_OR_INTERRUPT_TRANSFER (0x0009)
    IRP information: 0x00, Direction: FDO -> PDO
    URB bus id: 1
    Device address: 16
    Endpoint: 0x81, Direction: IN
    URB transfer type: URB_INTERRUPT (0x01)
    Packet Data Length: 0
    [Response in: 85]
    [bInterfaceClass: HID (0x03)]

No.     Time           Source                Destination           Protocol Length Info
     83 124.130959     1.16.1                host                  USB      35     URB_INTERRUPT in

Frame 83: 35 bytes on wire (280 bits), 35 bytes captured (280 bits) on interface \\.\USBPcap1, id 0
USB URB
    [Source: 1.16.1]
    [Destination: host]
    USBPcap pseudoheader length: 27
    IRP ID: 0xffff8082152e77a0
    IRP USBD_STATUS: USBD_STATUS_SUCCESS (0x00000000)
    URB Function: URB_FUNCTION_BULK_OR_INTERRUPT_TRANSFER (0x0009)
    IRP information: 0x01, Direction: PDO -> FDO
    URB bus id: 1
    Device address: 16
    Endpoint: 0x81, Direction: IN
    URB transfer type: URB_INTERRUPT (0x01)
    Packet Data Length: 8
    [Request in: 80]
    [Time from request: 16.271985000 seconds]
    [bInterfaceClass: HID (0x03)]
HID Data: 0100060000000000
    .... ...1 = Key: LeftControl (0xe0): DOWN
    .... ..0. = Key: LeftShift (0xe1): UP
    .... .0.. = Key: LeftAlt (0xe2): UP
    .... 0... = Key: LeftGUI (0xe3): UP
    ...0 .... = Key: RightControl (0xe4): UP
    ..0. .... = Key: RightShift (0xe5): UP
    .0.. .... = Key: RightAlt (0xe6): UP
    0... .... = Key: RightGUI (0xe7): UP
    Padding: 00
    Array: 060000000000
        0000 0110 = Usage: Keyboard c and C (0x0007, 0x0006)
        0000 0000 = Usage: Reserved (no event indicated) (0x0007, 0x0000)
        0000 0000 = Usage: Reserved (no event indicated) (0x0007, 0x0000)
        0000 0000 = Usage: Reserved (no event indicated) (0x0007, 0x0000)
        0000 0000 = Usage: Reserved (no event indicated) (0x0007, 0x0000)
        0000 0000 = Usage: Reserved (no event indicated) (0x0007, 0x0000)

No.     Time           Source                Destination           Protocol Length Info
     84 124.130986     host                  1.16.1                USB      27     URB_INTERRUPT in

Frame 84: 27 bytes on wire (216 bits), 27 bytes captured (216 bits) on interface \\.\USBPcap1, id 0
USB URB
    [Source: host]
    [Destination: 1.16.1]
    USBPcap pseudoheader length: 27
    IRP ID: 0xffff8082152e77a0
    IRP USBD_STATUS: USBD_STATUS_SUCCESS (0x00000000)
    URB Function: URB_FUNCTION_BULK_OR_INTERRUPT_TRANSFER (0x0009)
    IRP information: 0x00, Direction: FDO -> PDO
    URB bus id: 1
    Device address: 16
    Endpoint: 0x81, Direction: IN
    URB transfer type: URB_INTERRUPT (0x01)
    Packet Data Length: 0
    [Response in: 87]
    [bInterfaceClass: HID (0x03)]

No.     Time           Source                Destination           Protocol Length Info
     85 124.138962     1.16.1                host                  USB      35     URB_INTERRUPT in

Frame 85: 35 bytes on wire (280 bits), 35 bytes captured (280 bits) on interface \\.\USBPcap1, id 0
USB URB
    [Source: 1.16.1]
    [Destination: host]
    USBPcap pseudoheader length: 27
    IRP ID: 0xffff8081ffed67a0
    IRP USBD_STATUS: USBD_STATUS_SUCCESS (0x00000000)
    URB Function: URB_FUNCTION_BULK_OR_INTERRUPT_TRANSFER (0x0009)
    IRP information: 0x01, Direction: PDO -> FDO
    URB bus id: 1
    Device address: 16
    Endpoint: 0x81, Direction: IN
    URB transfer type: URB_INTERRUPT (0x01)
    Packet Data Length: 8
    [Request in: 82]
    [Time from request: 16.271963000 seconds]
    [bInterfaceClass: HID (0x03)]
HID Data: 0000000000000000
    .... ...0 = Key: LeftControl (0xe0): UP
    .... ..0. = Key: LeftShift (0xe1): UP
    .... .0.. = Key: LeftAlt (0xe2): UP
    .... 0... = Key: LeftGUI (0xe3): UP
    ...0 .... = Key: RightControl (0xe4): UP
    ..0. .... = Key: RightShift (0xe5): UP
    .0.. .... = Key: RightAlt (0xe6): UP
    0... .... = Key: RightGUI (0xe7): UP
    Padding: 00
    Array: 000000000000
        0000 0000 = Usage: Reserved (no event indicated) (0x0007, 0x0000)
        0000 0000 = Usage: Reserved (no event indicated) (0x0007, 0x0000)
        0000 0000 = Usage: Reserved (no event indicated) (0x0007, 0x0000)
        0000 0000 = Usage: Reserved (no event indicated) (0x0007, 0x0000)
        0000 0000 = Usage: Reserved (no event indicated) (0x0007, 0x0000)
        0000 0000 = Usage: Reserved (no event indicated) (0x0007, 0x0000)

No.     Time           Source                Destination           Protocol Length Info
     86 124.138994     host                  1.16.1                USB      27     URB_INTERRUPT in

Frame 86: 27 bytes on wire (216 bits), 27 bytes captured (216 bits) on interface \\.\USBPcap1, id 0
USB URB
    [Source: host]
    [Destination: 1.16.1]
    USBPcap pseudoheader length: 27
    IRP ID: 0xffff8081ffed67a0
    IRP USBD_STATUS: USBD_STATUS_SUCCESS (0x00000000)
    URB Function: URB_FUNCTION_BULK_OR_INTERRUPT_TRANSFER (0x0009)
    IRP information: 0x00, Direction: FDO -> PDO
    URB bus id: 1
    Device address: 16
    Endpoint: 0x81, Direction: IN
    URB transfer type: URB_INTERRUPT (0x01)
    Packet Data Length: 0
    [Response in: 89]
    [bInterfaceClass: HID (0x03)]

No.     Time           Source                Destination           Protocol Length Info
     87 136.714976     1.16.1                host                  USB      35     URB_INTERRUPT in

Frame 87: 35 bytes on wire (280 bits), 35 bytes captured (280 bits) on interface \\.\USBPcap1, id 0
USB URB
    [Source: 1.16.1]
    [Destination: host]
    USBPcap pseudoheader length: 27
    IRP ID: 0xffff8082152e77a0
    IRP USBD_STATUS: USBD_STATUS_SUCCESS (0x00000000)
    URB Function: URB_FUNCTION_BULK_OR_INTERRUPT_TRANSFER (0x0009)
    IRP information: 0x01, Direction: PDO -> FDO
    URB bus id: 1
    Device address: 16
    Endpoint: 0x81, Direction: IN
    URB transfer type: URB_INTERRUPT (0x01)
    Packet Data Length: 8
    [Request in: 84]
    [Time from request: 12.583990000 seconds]
    [bInterfaceClass: HID (0x03)]
HID Data: 0100190000000000
    .... ...1 = Key: LeftControl (0xe0): DOWN
    .... ..0. = Key: LeftShift (0xe1): UP
    .... .0.. = Key: LeftAlt (0xe2): UP
    .... 0... = Key: LeftGUI (0xe3): UP
    ...0 .... = Key: RightControl (0xe4): UP
    ..0. .... = Key: RightShift (0xe5): UP
    .0.. .... = Key: RightAlt (0xe6): UP
    0... .... = Key: RightGUI (0xe7): UP
    Padding: 00
    Array: 190000000000
        0001 1001 = Usage: Keyboard v and V (0x0007, 0x0019)
        0000 0000 = Usage: Reserved (no event indicated) (0x0007, 0x0000)
        0000 0000 = Usage: Reserved (no event indicated) (0x0007, 0x0000)
        0000 0000 = Usage: Reserved (no event indicated) (0x0007, 0x0000)
        0000 0000 = Usage: Reserved (no event indicated) (0x0007, 0x0000)
        0000 0000 = Usage: Reserved (no event indicated) (0x0007, 0x0000)

No.     Time           Source                Destination           Protocol Length Info
     88 136.715008     host                  1.16.1                USB      27     URB_INTERRUPT in

Frame 88: 27 bytes on wire (216 bits), 27 bytes captured (216 bits) on interface \\.\USBPcap1, id 0
USB URB
    [Source: host]
    [Destination: 1.16.1]
    USBPcap pseudoheader length: 27
    IRP ID: 0xffff8082152e77a0
    IRP USBD_STATUS: USBD_STATUS_SUCCESS (0x00000000)
    URB Function: URB_FUNCTION_BULK_OR_INTERRUPT_TRANSFER (0x0009)
    IRP information: 0x00, Direction: FDO -> PDO
    URB bus id: 1
    Device address: 16
    Endpoint: 0x81, Direction: IN
    URB transfer type: URB_INTERRUPT (0x01)
    Packet Data Length: 0
    [Response in: 91]
    [bInterfaceClass: HID (0x03)]

No.     Time           Source                Destination           Protocol Length Info
     89 136.722981     1.16.1                host                  USB      35     URB_INTERRUPT in

Frame 89: 35 bytes on wire (280 bits), 35 bytes captured (280 bits) on interface \\.\USBPcap1, id 0
USB URB
    [Source: 1.16.1]
    [Destination: host]
    USBPcap pseudoheader length: 27
    IRP ID: 0xffff8081ffed67a0
    IRP USBD_STATUS: USBD_STATUS_SUCCESS (0x00000000)
    URB Function: URB_FUNCTION_BULK_OR_INTERRUPT_TRANSFER (0x0009)
    IRP information: 0x01, Direction: PDO -> FDO
    URB bus id: 1
    Device address: 16
    Endpoint: 0x81, Direction: IN
    URB transfer type: URB_INTERRUPT (0x01)
    Packet Data Length: 8
    [Request in: 86]
    [Time from request: 12.583987000 seconds]
    [bInterfaceClass: HID (0x03)]
HID Data: 0000000000000000
    .... ...0 = Key: LeftControl (0xe0): UP
    .... ..0. = Key: LeftShift (0xe1): UP
    .... .0.. = Key: LeftAlt (0xe2): UP
    .... 0... = Key: LeftGUI (0xe3): UP
    ...0 .... = Key: RightControl (0xe4): UP
    ..0. .... = Key: RightShift (0xe5): UP
    .0.. .... = Key: RightAlt (0xe6): UP
    0... .... = Key: RightGUI (0xe7): UP
    Padding: 00
    Array: 000000000000
        0000 0000 = Usage: Reserved (no event indicated) (0x0007, 0x0000)
        0000 0000 = Usage: Reserved (no event indicated) (0x0007, 0x0000)
        0000 0000 = Usage: Reserved (no event indicated) (0x0007, 0x0000)
        0000 0000 = Usage: Reserved (no event indicated) (0x0007, 0x0000)
        0000 0000 = Usage: Reserved (no event indicated) (0x0007, 0x0000)
        0000 0000 = Usage: Reserved (no event indicated) (0x0007, 0x0000)

No.     Time           Source                Destination           Protocol Length Info
     90 136.723015     host                  1.16.1                USB      27     URB_INTERRUPT in

Frame 90: 27 bytes on wire (216 bits), 27 bytes captured (216 bits) on interface \\.\USBPcap1, id 0
USB URB
    [Source: host]
    [Destination: 1.16.1]
    USBPcap pseudoheader length: 27
    IRP ID: 0xffff8081ffed67a0
    IRP USBD_STATUS: USBD_STATUS_SUCCESS (0x00000000)
    URB Function: URB_FUNCTION_BULK_OR_INTERRUPT_TRANSFER (0x0009)
    IRP information: 0x00, Direction: FDO -> PDO
    URB bus id: 1
    Device address: 16
    Endpoint: 0x81, Direction: IN
    URB transfer type: URB_INTERRUPT (0x01)
    Packet Data Length: 0
    [Response in: 93]
    [bInterfaceClass: HID (0x03)]

No.     Time           Source                Destination           Protocol Length Info
     91 153.754991     1.16.1                host                  USB      35     URB_INTERRUPT in

Frame 91: 35 bytes on wire (280 bits), 35 bytes captured (280 bits) on interface \\.\USBPcap1, id 0
USB URB
    [Source: 1.16.1]
    [Destination: host]
    USBPcap pseudoheader length: 27
    IRP ID: 0xffff8082152e77a0
    IRP USBD_STATUS: USBD_STATUS_SUCCESS (0x00000000)
    URB Function: URB_FUNCTION_BULK_OR_INTERRUPT_TRANSFER (0x0009)
    IRP information: 0x01, Direction: PDO -> FDO
    URB bus id: 1
    Device address: 16
    Endpoint: 0x81, Direction: IN
    URB transfer type: URB_INTERRUPT (0x01)
    Packet Data Length: 8
    [Request in: 88]
    [Time from request: 17.039983000 seconds]
    [bInterfaceClass: HID (0x03)]
HID Data: 0100160000000000
    .... ...1 = Key: LeftControl (0xe0): DOWN
    .... ..0. = Key: LeftShift (0xe1): UP
    .... .0.. = Key: LeftAlt (0xe2): UP
    .... 0... = Key: LeftGUI (0xe3): UP
    ...0 .... = Key: RightControl (0xe4): UP
    ..0. .... = Key: RightShift (0xe5): UP
    .0.. .... = Key: RightAlt (0xe6): UP
    0... .... = Key: RightGUI (0xe7): UP
    Padding: 00
    Array: 160000000000
        0001 0110 = Usage: Keyboard s and S (0x0007, 0x0016)
        0000 0000 = Usage: Reserved (no event indicated) (0x0007, 0x0000)
        0000 0000 = Usage: Reserved (no event indicated) (0x0007, 0x0000)
        0000 0000 = Usage: Reserved (no event indicated) (0x0007, 0x0000)
        0000 0000 = Usage: Reserved (no event indicated) (0x0007, 0x0000)
        0000 0000 = Usage: Reserved (no event indicated) (0x0007, 0x0000)

No.     Time           Source                Destination           Protocol Length Info
     92 153.755023     host                  1.16.1                USB      27     URB_INTERRUPT in

Frame 92: 27 bytes on wire (216 bits), 27 bytes captured (216 bits) on interface \\.\USBPcap1, id 0
USB URB
    [Source: host]
    [Destination: 1.16.1]
    USBPcap pseudoheader length: 27
    IRP ID: 0xffff8082152e77a0
    IRP USBD_STATUS: USBD_STATUS_SUCCESS (0x00000000)
    URB Function: URB_FUNCTION_BULK_OR_INTERRUPT_TRANSFER (0x0009)
    IRP information: 0x00, Direction: FDO -> PDO
    URB bus id: 1
    Device address: 16
    Endpoint: 0x81, Direction: IN
    URB transfer type: URB_INTERRUPT (0x01)
    Packet Data Length: 0
    [Response in: 95]
    [bInterfaceClass: HID (0x03)]

No.     Time           Source                Destination           Protocol Length Info
     93 153.762993     1.16.1                host                  USB      35     URB_INTERRUPT in

Frame 93: 35 bytes on wire (280 bits), 35 bytes captured (280 bits) on interface \\.\USBPcap1, id 0
USB URB
    [Source: 1.16.1]
    [Destination: host]
    USBPcap pseudoheader length: 27
    IRP ID: 0xffff8081ffed67a0
    IRP USBD_STATUS: USBD_STATUS_SUCCESS (0x00000000)
    URB Function: URB_FUNCTION_BULK_OR_INTERRUPT_TRANSFER (0x0009)
    IRP information: 0x01, Direction: PDO -> FDO
    URB bus id: 1
    Device address: 16
    Endpoint: 0x81, Direction: IN
    URB transfer type: URB_INTERRUPT (0x01)
    Packet Data Length: 8
    [Request in: 90]
    [Time from request: 17.039978000 seconds]
    [bInterfaceClass: HID (0x03)]
HID Data: 0000000000000000
    .... ...0 = Key: LeftControl (0xe0): UP
    .... ..0. = Key: LeftShift (0xe1): UP
    .... .0.. = Key: LeftAlt (0xe2): UP
    .... 0... = Key: LeftGUI (0xe3): UP
    ...0 .... = Key: RightControl (0xe4): UP
    ..0. .... = Key: RightShift (0xe5): UP
    .0.. .... = Key: RightAlt (0xe6): UP
    0... .... = Key: RightGUI (0xe7): UP
    Padding: 00
    Array: 000000000000
        0000 0000 = Usage: Reserved (no event indicated) (0x0007, 0x0000)
        0000 0000 = Usage: Reserved (no event indicated) (0x0007, 0x0000)
        0000 0000 = Usage: Reserved (no event indicated) (0x0007, 0x0000)
        0000 0000 = Usage: Reserved (no event indicated) (0x0007, 0x0000)
        0000 0000 = Usage: Reserved (no event indicated) (0x0007, 0x0000)
        0000 0000 = Usage: Reserved (no event indicated) (0x0007, 0x0000)

No.     Time           Source                Destination           Protocol Length Info
     94 153.763023     host                  1.16.1                USB      27     URB_INTERRUPT in

Frame 94: 27 bytes on wire (216 bits), 27 bytes captured (216 bits) on interface \\.\USBPcap1, id 0
USB URB
    [Source: host]
    [Destination: 1.16.1]
    USBPcap pseudoheader length: 27
    IRP ID: 0xffff8081ffed67a0
    IRP USBD_STATUS: USBD_STATUS_SUCCESS (0x00000000)
    URB Function: URB_FUNCTION_BULK_OR_INTERRUPT_TRANSFER (0x0009)
    IRP information: 0x00, Direction: FDO -> PDO
    URB bus id: 1
    Device address: 16
    Endpoint: 0x81, Direction: IN
    URB transfer type: URB_INTERRUPT (0x01)
    Packet Data Length: 0
    [Response in: 97]
    [bInterfaceClass: HID (0x03)]

No.     Time           Source                Destination           Protocol Length Info
     95 168.691007     1.16.1                host                  USB      35     URB_INTERRUPT in

Frame 95: 35 bytes on wire (280 bits), 35 bytes captured (280 bits) on interface \\.\USBPcap1, id 0
USB URB
    [Source: 1.16.1]
    [Destination: host]
    USBPcap pseudoheader length: 27
    IRP ID: 0xffff8082152e77a0
    IRP USBD_STATUS: USBD_STATUS_SUCCESS (0x00000000)
    URB Function: URB_FUNCTION_BULK_OR_INTERRUPT_TRANSFER (0x0009)
    IRP information: 0x01, Direction: PDO -> FDO
    URB bus id: 1
    Device address: 16
    Endpoint: 0x81, Direction: IN
    URB transfer type: URB_INTERRUPT (0x01)
    Packet Data Length: 8
    [Request in: 92]
    [Time from request: 14.935984000 seconds]
    [bInterfaceClass: HID (0x03)]
HID Data: 0400000000000000
    .... ...0 = Key: LeftControl (0xe0): UP
    .... ..0. = Key: LeftShift (0xe1): UP
    .... .1.. = Key: LeftAlt (0xe2): DOWN
    .... 0... = Key: LeftGUI (0xe3): UP
    ...0 .... = Key: RightControl (0xe4): UP
    ..0. .... = Key: RightShift (0xe5): UP
    .0.. .... = Key: RightAlt (0xe6): UP
    0... .... = Key: RightGUI (0xe7): UP
    Padding: 00
    Array: 000000000000
        0000 0000 = Usage: Reserved (no event indicated) (0x0007, 0x0000)
        0000 0000 = Usage: Reserved (no event indicated) (0x0007, 0x0000)
        0000 0000 = Usage: Reserved (no event indicated) (0x0007, 0x0000)
        0000 0000 = Usage: Reserved (no event indicated) (0x0007, 0x0000)
        0000 0000 = Usage: Reserved (no event indicated) (0x0007, 0x0000)
        0000 0000 = Usage: Reserved (no event indicated) (0x0007, 0x0000)

No.     Time           Source                Destination           Protocol Length Info
     96 168.691039     host                  1.16.1                USB      27     URB_INTERRUPT in

Frame 96: 27 bytes on wire (216 bits), 27 bytes captured (216 bits) on interface \\.\USBPcap1, id 0
USB URB
    [Source: host]
    [Destination: 1.16.1]
    USBPcap pseudoheader length: 27
    IRP ID: 0xffff8082152e77a0
    IRP USBD_STATUS: USBD_STATUS_SUCCESS (0x00000000)
    URB Function: URB_FUNCTION_BULK_OR_INTERRUPT_TRANSFER (0x0009)
    IRP information: 0x00, Direction: FDO -> PDO
    URB bus id: 1
    Device address: 16
    Endpoint: 0x81, Direction: IN
    URB transfer type: URB_INTERRUPT (0x01)
    Packet Data Length: 0
    [Response in: 99]
    [bInterfaceClass: HID (0x03)]

No.     Time           Source                Destination           Protocol Length Info
     97 168.699015     1.16.1                host                  USB      35     URB_INTERRUPT in

Frame 97: 35 bytes on wire (280 bits), 35 bytes captured (280 bits) on interface \\.\USBPcap1, id 0
USB URB
    [Source: 1.16.1]
    [Destination: host]
    USBPcap pseudoheader length: 27
    IRP ID: 0xffff8081ffed67a0
    IRP USBD_STATUS: USBD_STATUS_SUCCESS (0x00000000)
    URB Function: URB_FUNCTION_BULK_OR_INTERRUPT_TRANSFER (0x0009)
    IRP information: 0x01, Direction: PDO -> FDO
    URB bus id: 1
    Device address: 16
    Endpoint: 0x81, Direction: IN
    URB transfer type: URB_INTERRUPT (0x01)
    Packet Data Length: 8
    [Request in: 94]
    [Time from request: 14.935992000 seconds]
    [bInterfaceClass: HID (0x03)]
HID Data: 04002b0000000000
    .... ...0 = Key: LeftControl (0xe0): UP
    .... ..0. = Key: LeftShift (0xe1): UP
    .... .1.. = Key: LeftAlt (0xe2): DOWN
    .... 0... = Key: LeftGUI (0xe3): UP
    ...0 .... = Key: RightControl (0xe4): UP
    ..0. .... = Key: RightShift (0xe5): UP
    .0.. .... = Key: RightAlt (0xe6): UP
    0... .... = Key: RightGUI (0xe7): UP
    Padding: 00
    Array: 2b0000000000
        0010 1011 = Usage: Keyboard Tab (0x0007, 0x002b)
        0000 0000 = Usage: Reserved (no event indicated) (0x0007, 0x0000)
        0000 0000 = Usage: Reserved (no event indicated) (0x0007, 0x0000)
        0000 0000 = Usage: Reserved (no event indicated) (0x0007, 0x0000)
        0000 0000 = Usage: Reserved (no event indicated) (0x0007, 0x0000)
        0000 0000 = Usage: Reserved (no event indicated) (0x0007, 0x0000)

No.     Time           Source                Destination           Protocol Length Info
     98 168.699048     host                  1.16.1                USB      27     URB_INTERRUPT in

Frame 98: 27 bytes on wire (216 bits), 27 bytes captured (216 bits) on interface \\.\USBPcap1, id 0
USB URB
    [Source: host]
    [Destination: 1.16.1]
    USBPcap pseudoheader length: 27
    IRP ID: 0xffff8081ffed67a0
    IRP USBD_STATUS: USBD_STATUS_SUCCESS (0x00000000)
    URB Function: URB_FUNCTION_BULK_OR_INTERRUPT_TRANSFER (0x0009)
    IRP information: 0x00, Direction: FDO -> PDO
    URB bus id: 1
    Device address: 16
    Endpoint: 0x81, Direction: IN
    URB transfer type: URB_INTERRUPT (0x01)
    Packet Data Length: 0
    [Response in: 101]
    [bInterfaceClass: HID (0x03)]

No.     Time           Source                Destination           Protocol Length Info
     99 168.707000     1.16.1                host                  USB      35     URB_INTERRUPT in

Frame 99: 35 bytes on wire (280 bits), 35 bytes captured (280 bits) on interface \\.\USBPcap1, id 0
USB URB
    [Source: 1.16.1]
    [Destination: host]
    USBPcap pseudoheader length: 27
    IRP ID: 0xffff8082152e77a0
    IRP USBD_STATUS: USBD_STATUS_SUCCESS (0x00000000)
    URB Function: URB_FUNCTION_BULK_OR_INTERRUPT_TRANSFER (0x0009)
    IRP information: 0x01, Direction: PDO -> FDO
    URB bus id: 1
    Device address: 16
    Endpoint: 0x81, Direction: IN
    URB transfer type: URB_INTERRUPT (0x01)
    Packet Data Length: 8
    [Request in: 96]
    [Time from request: 0.015961000 seconds]
    [bInterfaceClass: HID (0x03)]
HID Data: 0000000000000000
    .... ...0 = Key: LeftControl (0xe0): UP
    .... ..0. = Key: LeftShift (0xe1): UP
    .... .0.. = Key: LeftAlt (0xe2): UP
    .... 0... = Key: LeftGUI (0xe3): UP
    ...0 .... = Key: RightControl (0xe4): UP
    ..0. .... = Key: RightShift (0xe5): UP
    .0.. .... = Key: RightAlt (0xe6): UP
    0... .... = Key: RightGUI (0xe7): UP
    Padding: 00
    Array: 000000000000
        0000 0000 = Usage: Reserved (no event indicated) (0x0007, 0x0000)
        0000 0000 = Usage: Reserved (no event indicated) (0x0007, 0x0000)
        0000 0000 = Usage: Reserved (no event indicated) (0x0007, 0x0000)
        0000 0000 = Usage: Reserved (no event indicated) (0x0007, 0x0000)
        0000 0000 = Usage: Reserved (no event indicated) (0x0007, 0x0000)
        0000 0000 = Usage: Reserved (no event indicated) (0x0007, 0x0000)

No.     Time           Source                Destination           Protocol Length Info
    100 168.707067     host                  1.16.1                USB      27     URB_INTERRUPT in

Frame 100: 27 bytes on wire (216 bits), 27 bytes captured (216 bits) on interface \\.\USBPcap1, id 0
USB URB
    [Source: host]
    [Destination: 1.16.1]
    USBPcap pseudoheader length: 27
    IRP ID: 0xffff8082152e77a0
    IRP USBD_STATUS: USBD_STATUS_SUCCESS (0x00000000)
    URB Function: URB_FUNCTION_BULK_OR_INTERRUPT_TRANSFER (0x0009)
    IRP information: 0x00, Direction: FDO -> PDO
    URB bus id: 1
    Device address: 16
    Endpoint: 0x81, Direction: IN
    URB transfer type: URB_INTERRUPT (0x01)
    Packet Data Length: 0
    [Response in: 103]
    [bInterfaceClass: HID (0x03)]

No.     Time           Source                Destination           Protocol Length Info
    101 190.515032     1.16.1                host                  USB      35     URB_INTERRUPT in

Frame 101: 35 bytes on wire (280 bits), 35 bytes captured (280 bits) on interface \\.\USBPcap1, id 0
USB URB
    [Source: 1.16.1]
    [Destination: host]
    USBPcap pseudoheader length: 27
    IRP ID: 0xffff8081ffed67a0
    IRP USBD_STATUS: USBD_STATUS_SUCCESS (0x00000000)
    URB Function: URB_FUNCTION_BULK_OR_INTERRUPT_TRANSFER (0x0009)
    IRP information: 0x01, Direction: PDO -> FDO
    URB bus id: 1
    Device address: 16
    Endpoint: 0x81, Direction: IN
    URB transfer type: URB_INTERRUPT (0x01)
    Packet Data Length: 8
    [Request in: 98]
    [Time from request: 21.815984000 seconds]
    [bInterfaceClass: HID (0x03)]
HID Data: 00001f0000000000
    .... ...0 = Key: LeftControl (0xe0): UP
    .... ..0. = Key: LeftShift (0xe1): UP
    .... .0.. = Key: LeftAlt (0xe2): UP
    .... 0... = Key: LeftGUI (0xe3): UP
    ...0 .... = Key: RightControl (0xe4): UP
    ..0. .... = Key: RightShift (0xe5): UP
    .0.. .... = Key: RightAlt (0xe6): UP
    0... .... = Key: RightGUI (0xe7): UP
    Padding: 00
    Array: 1f0000000000
        0001 1111 = Usage: Keyboard 2 and @ (0x0007, 0x001f)
        0000 0000 = Usage: Reserved (no event indicated) (0x0007, 0x0000)
        0000 0000 = Usage: Reserved (no event indicated) (0x0007, 0x0000)
        0000 0000 = Usage: Reserved (no event indicated) (0x0007, 0x0000)
        0000 0000 = Usage: Reserved (no event indicated) (0x0007, 0x0000)
        0000 0000 = Usage: Reserved (no event indicated) (0x0007, 0x0000)

No.     Time           Source                Destination           Protocol Length Info
    102 190.515066     host                  1.16.1                USB      27     URB_INTERRUPT in

Frame 102: 27 bytes on wire (216 bits), 27 bytes captured (216 bits) on interface \\.\USBPcap1, id 0
USB URB
    [Source: host]
    [Destination: 1.16.1]
    USBPcap pseudoheader length: 27
    IRP ID: 0xffff8081ffed67a0
    IRP USBD_STATUS: USBD_STATUS_SUCCESS (0x00000000)
    URB Function: URB_FUNCTION_BULK_OR_INTERRUPT_TRANSFER (0x0009)
    IRP information: 0x00, Direction: FDO -> PDO
    URB bus id: 1
    Device address: 16
    Endpoint: 0x81, Direction: IN
    URB transfer type: URB_INTERRUPT (0x01)
    Packet Data Length: 0
    [Response in: 105]
    [bInterfaceClass: HID (0x03)]

No.     Time           Source                Destination           Protocol Length Info
    103 190.523034     1.16.1                host                  USB      35     URB_INTERRUPT in

Frame 103: 35 bytes on wire (280 bits), 35 bytes captured (280 bits) on interface \\.\USBPcap1, id 0
USB URB
    [Source: 1.16.1]
    [Destination: host]
    USBPcap pseudoheader length: 27
    IRP ID: 0xffff8082152e77a0
    IRP USBD_STATUS: USBD_STATUS_SUCCESS (0x00000000)
    URB Function: URB_FUNCTION_BULK_OR_INTERRUPT_TRANSFER (0x0009)
    IRP information: 0x01, Direction: PDO -> FDO
    URB bus id: 1
    Device address: 16
    Endpoint: 0x81, Direction: IN
    URB transfer type: URB_INTERRUPT (0x01)
    Packet Data Length: 8
    [Request in: 100]
    [Time from request: 21.815967000 seconds]
    [bInterfaceClass: HID (0x03)]
HID Data: 0000000000000000
    .... ...0 = Key: LeftControl (0xe0): UP
    .... ..0. = Key: LeftShift (0xe1): UP
    .... .0.. = Key: LeftAlt (0xe2): UP
    .... 0... = Key: LeftGUI (0xe3): UP
    ...0 .... = Key: RightControl (0xe4): UP
    ..0. .... = Key: RightShift (0xe5): UP
    .0.. .... = Key: RightAlt (0xe6): UP
    0... .... = Key: RightGUI (0xe7): UP
    Padding: 00
    Array: 000000000000
        0000 0000 = Usage: Reserved (no event indicated) (0x0007, 0x0000)
        0000 0000 = Usage: Reserved (no event indicated) (0x0007, 0x0000)
        0000 0000 = Usage: Reserved (no event indicated) (0x0007, 0x0000)
        0000 0000 = Usage: Reserved (no event indicated) (0x0007, 0x0000)
        0000 0000 = Usage: Reserved (no event indicated) (0x0007, 0x0000)
        0000 0000 = Usage: Reserved (no event indicated) (0x0007, 0x0000)

No.     Time           Source                Destination           Protocol Length Info
    104 190.523069     host                  1.16.1                USB      27     URB_INTERRUPT in

Frame 104: 27 bytes on wire (216 bits), 27 bytes captured (216 bits) on interface \\.\USBPcap1, id 0
USB URB
    [Source: host]
    [Destination: 1.16.1]
    USBPcap pseudoheader length: 27
    IRP ID: 0xffff8082152e77a0
    IRP USBD_STATUS: USBD_STATUS_SUCCESS (0x00000000)
    URB Function: URB_FUNCTION_BULK_OR_INTERRUPT_TRANSFER (0x0009)
    IRP information: 0x00, Direction: FDO -> PDO
    URB bus id: 1
    Device address: 16
    Endpoint: 0x81, Direction: IN
    URB transfer type: URB_INTERRUPT (0x01)
    Packet Data Length: 0
    [Response in: 107]
    [bInterfaceClass: HID (0x03)]

No.     Time           Source                Destination           Protocol Length Info
    105 190.715023     1.16.1                host                  USB      35     URB_INTERRUPT in

Frame 105: 35 bytes on wire (280 bits), 35 bytes captured (280 bits) on interface \\.\USBPcap1, id 0
USB URB
    [Source: 1.16.1]
    [Destination: host]
    USBPcap pseudoheader length: 27
    IRP ID: 0xffff8081ffed67a0
    IRP USBD_STATUS: USBD_STATUS_SUCCESS (0x00000000)
    URB Function: URB_FUNCTION_BULK_OR_INTERRUPT_TRANSFER (0x0009)
    IRP information: 0x01, Direction: PDO -> FDO
    URB bus id: 1
    Device address: 16
    Endpoint: 0x81, Direction: IN
    URB transfer type: URB_INTERRUPT (0x01)
    Packet Data Length: 8
    [Request in: 102]
    [Time from request: 0.199957000 seconds]
    [bInterfaceClass: HID (0x03)]
HID Data: 00001f0000000000
    .... ...0 = Key: LeftControl (0xe0): UP
    .... ..0. = Key: LeftShift (0xe1): UP
    .... .0.. = Key: LeftAlt (0xe2): UP
    .... 0... = Key: LeftGUI (0xe3): UP
    ...0 .... = Key: RightControl (0xe4): UP
    ..0. .... = Key: RightShift (0xe5): UP
    .0.. .... = Key: RightAlt (0xe6): UP
    0... .... = Key: RightGUI (0xe7): UP
    Padding: 00
    Array: 1f0000000000
        0001 1111 = Usage: Keyboard 2 and @ (0x0007, 0x001f)
        0000 0000 = Usage: Reserved (no event indicated) (0x0007, 0x0000)
        0000 0000 = Usage: Reserved (no event indicated) (0x0007, 0x0000)
        0000 0000 = Usage: Reserved (no event indicated) (0x0007, 0x0000)
        0000 0000 = Usage: Reserved (no event indicated) (0x0007, 0x0000)
        0000 0000 = Usage: Reserved (no event indicated) (0x0007, 0x0000)

No.     Time           Source                Destination           Protocol Length Info
    106 190.715061     host                  1.16.1                USB      27     URB_INTERRUPT in

Frame 106: 27 bytes on wire (216 bits), 27 bytes captured (216 bits) on interface \\.\USBPcap1, id 0
USB URB
    [Source: host]
    [Destination: 1.16.1]
    USBPcap pseudoheader length: 27
    IRP ID: 0xffff8081ffed67a0
    IRP USBD_STATUS: USBD_STATUS_SUCCESS (0x00000000)
    URB Function: URB_FUNCTION_BULK_OR_INTERRUPT_TRANSFER (0x0009)
    IRP information: 0x00, Direction: FDO -> PDO
    URB bus id: 1
    Device address: 16
    Endpoint: 0x81, Direction: IN
    URB transfer type: URB_INTERRUPT (0x01)
    Packet Data Length: 0
    [Response in: 109]
    [bInterfaceClass: HID (0x03)]

No.     Time           Source                Destination           Protocol Length Info
    107 190.723119     1.16.1                host                  USB      35     URB_INTERRUPT in

Frame 107: 35 bytes on wire (280 bits), 35 bytes captured (280 bits) on interface \\.\USBPcap1, id 0
USB URB
    [Source: 1.16.1]
    [Destination: host]
    USBPcap pseudoheader length: 27
    IRP ID: 0xffff8082152e77a0
    IRP USBD_STATUS: USBD_STATUS_SUCCESS (0x00000000)
    URB Function: URB_FUNCTION_BULK_OR_INTERRUPT_TRANSFER (0x0009)
    IRP information: 0x01, Direction: PDO -> FDO
    URB bus id: 1
    Device address: 16
    Endpoint: 0x81, Direction: IN
    URB transfer type: URB_INTERRUPT (0x01)
    Packet Data Length: 8
    [Request in: 104]
    [Time from request: 0.200050000 seconds]
    [bInterfaceClass: HID (0x03)]
HID Data: 0000000000000000
    .... ...0 = Key: LeftControl (0xe0): UP
    .... ..0. = Key: LeftShift (0xe1): UP
    .... .0.. = Key: LeftAlt (0xe2): UP
    .... 0... = Key: LeftGUI (0xe3): UP
    ...0 .... = Key: RightControl (0xe4): UP
    ..0. .... = Key: RightShift (0xe5): UP
    .0.. .... = Key: RightAlt (0xe6): UP
    0... .... = Key: RightGUI (0xe7): UP
    Padding: 00
    Array: 000000000000
        0000 0000 = Usage: Reserved (no event indicated) (0x0007, 0x0000)
        0000 0000 = Usage: Reserved (no event indicated) (0x0007, 0x0000)
        0000 0000 = Usage: Reserved (no event indicated) (0x0007, 0x0000)
        0000 0000 = Usage: Reserved (no event indicated) (0x0007, 0x0000)
        0000 0000 = Usage: Reserved (no event indicated) (0x0007, 0x0000)
        0000 0000 = Usage: Reserved (no event indicated) (0x0007, 0x0000)

No.     Time           Source                Destination           Protocol Length Info
    108 190.723214     host                  1.16.1                USB      27     URB_INTERRUPT in

Frame 108: 27 bytes on wire (216 bits), 27 bytes captured (216 bits) on interface \\.\USBPcap1, id 0
USB URB
    [Source: host]
    [Destination: 1.16.1]
    USBPcap pseudoheader length: 27
    IRP ID: 0xffff8082152e77a0
    IRP USBD_STATUS: USBD_STATUS_SUCCESS (0x00000000)
    URB Function: URB_FUNCTION_BULK_OR_INTERRUPT_TRANSFER (0x0009)
    IRP information: 0x00, Direction: FDO -> PDO
    URB bus id: 1
    Device address: 16
    Endpoint: 0x81, Direction: IN
    URB transfer type: URB_INTERRUPT (0x01)
    Packet Data Length: 0
    [Response in: 111]
    [bInterfaceClass: HID (0x03)]

No.     Time           Source                Destination           Protocol Length Info
    109 190.915023     1.16.1                host                  USB      35     URB_INTERRUPT in

Frame 109: 35 bytes on wire (280 bits), 35 bytes captured (280 bits) on interface \\.\USBPcap1, id 0
USB URB
    [Source: 1.16.1]
    [Destination: host]
    USBPcap pseudoheader length: 27
    IRP ID: 0xffff8081ffed67a0
    IRP USBD_STATUS: USBD_STATUS_SUCCESS (0x00000000)
    URB Function: URB_FUNCTION_BULK_OR_INTERRUPT_TRANSFER (0x0009)
    IRP information: 0x01, Direction: PDO -> FDO
    URB bus id: 1
    Device address: 16
    Endpoint: 0x81, Direction: IN
    URB transfer type: URB_INTERRUPT (0x01)
    Packet Data Length: 8
    [Request in: 106]
    [Time from request: 0.199962000 seconds]
    [bInterfaceClass: HID (0x03)]
HID Data: 00001f0000000000
    .... ...0 = Key: LeftControl (0xe0): UP
    .... ..0. = Key: LeftShift (0xe1): UP
    .... .0.. = Key: LeftAlt (0xe2): UP
    .... 0... = Key: LeftGUI (0xe3): UP
    ...0 .... = Key: RightControl (0xe4): UP
    ..0. .... = Key: RightShift (0xe5): UP
    .0.. .... = Key: RightAlt (0xe6): UP
    0... .... = Key: RightGUI (0xe7): UP
    Padding: 00
    Array: 1f0000000000
        0001 1111 = Usage: Keyboard 2 and @ (0x0007, 0x001f)
        0000 0000 = Usage: Reserved (no event indicated) (0x0007, 0x0000)
        0000 0000 = Usage: Reserved (no event indicated) (0x0007, 0x0000)
        0000 0000 = Usage: Reserved (no event indicated) (0x0007, 0x0000)
        0000 0000 = Usage: Reserved (no event indicated) (0x0007, 0x0000)
        0000 0000 = Usage: Reserved (no event indicated) (0x0007, 0x0000)

No.     Time           Source                Destination           Protocol Length Info
    110 190.915054     host                  1.16.1                USB      27     URB_INTERRUPT in

Frame 110: 27 bytes on wire (216 bits), 27 bytes captured (216 bits) on interface \\.\USBPcap1, id 0
USB URB
    [Source: host]
    [Destination: 1.16.1]
    USBPcap pseudoheader length: 27
    IRP ID: 0xffff8081ffed67a0
    IRP USBD_STATUS: USBD_STATUS_SUCCESS (0x00000000)
    URB Function: URB_FUNCTION_BULK_OR_INTERRUPT_TRANSFER (0x0009)
    IRP information: 0x00, Direction: FDO -> PDO
    URB bus id: 1
    Device address: 16
    Endpoint: 0x81, Direction: IN
    URB transfer type: URB_INTERRUPT (0x01)
    Packet Data Length: 0
    [Response in: 113]
    [bInterfaceClass: HID (0x03)]

No.     Time           Source                Destination           Protocol Length Info
    111 190.923135     1.16.1                host                  USB      35     URB_INTERRUPT in

Frame 111: 35 bytes on wire (280 bits), 35 bytes captured (280 bits) on interface \\.\USBPcap1, id 0
USB URB
    [Source: 1.16.1]
    [Destination: host]
    USBPcap pseudoheader length: 27
    IRP ID: 0xffff8082152e77a0
    IRP USBD_STATUS: USBD_STATUS_SUCCESS (0x00000000)
    URB Function: URB_FUNCTION_BULK_OR_INTERRUPT_TRANSFER (0x0009)
    IRP information: 0x01, Direction: PDO -> FDO
    URB bus id: 1
    Device address: 16
    Endpoint: 0x81, Direction: IN
    URB transfer type: URB_INTERRUPT (0x01)
    Packet Data Length: 8
    [Request in: 108]
    [Time from request: 0.199921000 seconds]
    [bInterfaceClass: HID (0x03)]
HID Data: 0000000000000000
    .... ...0 = Key: LeftControl (0xe0): UP
    .... ..0. = Key: LeftShift (0xe1): UP
    .... .0.. = Key: LeftAlt (0xe2): UP
    .... 0... = Key: LeftGUI (0xe3): UP
    ...0 .... = Key: RightControl (0xe4): UP
    ..0. .... = Key: RightShift (0xe5): UP
    .0.. .... = Key: RightAlt (0xe6): UP
    0... .... = Key: RightGUI (0xe7): UP
    Padding: 00
    Array: 000000000000
        0000 0000 = Usage: Reserved (no event indicated) (0x0007, 0x0000)
        0000 0000 = Usage: Reserved (no event indicated) (0x0007, 0x0000)
        0000 0000 = Usage: Reserved (no event indicated) (0x0007, 0x0000)
        0000 0000 = Usage: Reserved (no event indicated) (0x0007, 0x0000)
        0000 0000 = Usage: Reserved (no event indicated) (0x0007, 0x0000)
        0000 0000 = Usage: Reserved (no event indicated) (0x0007, 0x0000)

No.     Time           Source                Destination           Protocol Length Info
    112 190.923215     host                  1.16.1                USB      27     URB_INTERRUPT in

Frame 112: 27 bytes on wire (216 bits), 27 bytes captured (216 bits) on interface \\.\USBPcap1, id 0
USB URB
    [Source: host]
    [Destination: 1.16.1]
    USBPcap pseudoheader length: 27
    IRP ID: 0xffff8082152e77a0
    IRP USBD_STATUS: USBD_STATUS_SUCCESS (0x00000000)
    URB Function: URB_FUNCTION_BULK_OR_INTERRUPT_TRANSFER (0x0009)
    IRP information: 0x00, Direction: FDO -> PDO
    URB bus id: 1
    Device address: 16
    Endpoint: 0x81, Direction: IN
    URB transfer type: URB_INTERRUPT (0x01)
    Packet Data Length: 0
    [Response in: 115]
    [bInterfaceClass: HID (0x03)]

No.     Time           Source                Destination           Protocol Length Info
    113 191.115025     1.16.1                host                  USB      35     URB_INTERRUPT in

Frame 113: 35 bytes on wire (280 bits), 35 bytes captured (280 bits) on interface \\.\USBPcap1, id 0
USB URB
    [Source: 1.16.1]
    [Destination: host]
    USBPcap pseudoheader length: 27
    IRP ID: 0xffff8081ffed67a0
    IRP USBD_STATUS: USBD_STATUS_SUCCESS (0x00000000)
    URB Function: URB_FUNCTION_BULK_OR_INTERRUPT_TRANSFER (0x0009)
    IRP information: 0x01, Direction: PDO -> FDO
    URB bus id: 1
    Device address: 16
    Endpoint: 0x81, Direction: IN
    URB transfer type: URB_INTERRUPT (0x01)
    Packet Data Length: 8
    [Request in: 110]
    [Time from request: 0.199971000 seconds]
    [bInterfaceClass: HID (0x03)]
HID Data: 00001f0000000000
    .... ...0 = Key: LeftControl (0xe0): UP
    .... ..0. = Key: LeftShift (0xe1): UP
    .... .0.. = Key: LeftAlt (0xe2): UP
    .... 0... = Key: LeftGUI (0xe3): UP
    ...0 .... = Key: RightControl (0xe4): UP
    ..0. .... = Key: RightShift (0xe5): UP
    .0.. .... = Key: RightAlt (0xe6): UP
    0... .... = Key: RightGUI (0xe7): UP
    Padding: 00
    Array: 1f0000000000
        0001 1111 = Usage: Keyboard 2 and @ (0x0007, 0x001f)
        0000 0000 = Usage: Reserved (no event indicated) (0x0007, 0x0000)
        0000 0000 = Usage: Reserved (no event indicated) (0x0007, 0x0000)
        0000 0000 = Usage: Reserved (no event indicated) (0x0007, 0x0000)
        0000 0000 = Usage: Reserved (no event indicated) (0x0007, 0x0000)
        0000 0000 = Usage: Reserved (no event indicated) (0x0007, 0x0000)

No.     Time           Source                Destination           Protocol Length Info
    114 191.115060     host                  1.16.1                USB      27     URB_INTERRUPT in

Frame 114: 27 bytes on wire (216 bits), 27 bytes captured (216 bits) on interface \\.\USBPcap1, id 0
USB URB
    [Source: host]
    [Destination: 1.16.1]
    USBPcap pseudoheader length: 27
    IRP ID: 0xffff8081ffed67a0
    IRP USBD_STATUS: USBD_STATUS_SUCCESS (0x00000000)
    URB Function: URB_FUNCTION_BULK_OR_INTERRUPT_TRANSFER (0x0009)
    IRP information: 0x00, Direction: FDO -> PDO
    URB bus id: 1
    Device address: 16
    Endpoint: 0x81, Direction: IN
    URB transfer type: URB_INTERRUPT (0x01)
    Packet Data Length: 0
    [Response in: 117]
    [bInterfaceClass: HID (0x03)]

No.     Time           Source                Destination           Protocol Length Info
    115 191.123056     1.16.1                host                  USB      35     URB_INTERRUPT in

Frame 115: 35 bytes on wire (280 bits), 35 bytes captured (280 bits) on interface \\.\USBPcap1, id 0
USB URB
    [Source: 1.16.1]
    [Destination: host]
    USBPcap pseudoheader length: 27
    IRP ID: 0xffff8082152e77a0
    IRP USBD_STATUS: USBD_STATUS_SUCCESS (0x00000000)
    URB Function: URB_FUNCTION_BULK_OR_INTERRUPT_TRANSFER (0x0009)
    IRP information: 0x01, Direction: PDO -> FDO
    URB bus id: 1
    Device address: 16
    Endpoint: 0x81, Direction: IN
    URB transfer type: URB_INTERRUPT (0x01)
    Packet Data Length: 8
    [Request in: 112]
    [Time from request: 0.199841000 seconds]
    [bInterfaceClass: HID (0x03)]
HID Data: 0000000000000000
    .... ...0 = Key: LeftControl (0xe0): UP
    .... ..0. = Key: LeftShift (0xe1): UP
    .... .0.. = Key: LeftAlt (0xe2): UP
    .... 0... = Key: LeftGUI (0xe3): UP
    ...0 .... = Key: RightControl (0xe4): UP
    ..0. .... = Key: RightShift (0xe5): UP
    .0.. .... = Key: RightAlt (0xe6): UP
    0... .... = Key: RightGUI (0xe7): UP
    Padding: 00
    Array: 000000000000
        0000 0000 = Usage: Reserved (no event indicated) (0x0007, 0x0000)
        0000 0000 = Usage: Reserved (no event indicated) (0x0007, 0x0000)
        0000 0000 = Usage: Reserved (no event indicated) (0x0007, 0x0000)
        0000 0000 = Usage: Reserved (no event indicated) (0x0007, 0x0000)
        0000 0000 = Usage: Reserved (no event indicated) (0x0007, 0x0000)
        0000 0000 = Usage: Reserved (no event indicated) (0x0007, 0x0000)

No.     Time           Source                Destination           Protocol Length Info
    116 191.123143     host                  1.16.1                USB      27     URB_INTERRUPT in

Frame 116: 27 bytes on wire (216 bits), 27 bytes captured (216 bits) on interface \\.\USBPcap1, id 0
USB URB
    [Source: host]
    [Destination: 1.16.1]
    USBPcap pseudoheader length: 27
    IRP ID: 0xffff8082152e77a0
    IRP USBD_STATUS: USBD_STATUS_SUCCESS (0x00000000)
    URB Function: URB_FUNCTION_BULK_OR_INTERRUPT_TRANSFER (0x0009)
    IRP information: 0x00, Direction: FDO -> PDO
    URB bus id: 1
    Device address: 16
    Endpoint: 0x81, Direction: IN
    URB transfer type: URB_INTERRUPT (0x01)
    Packet Data Length: 0
    [Response in: 119]
    [bInterfaceClass: HID (0x03)]

No.     Time           Source                Destination           Protocol Length Info
    117 191.315030     1.16.1                host                  USB      35     URB_INTERRUPT in

Frame 117: 35 bytes on wire (280 bits), 35 bytes captured (280 bits) on interface \\.\USBPcap1, id 0
USB URB
    [Source: 1.16.1]
    [Destination: host]
    USBPcap pseudoheader length: 27
    IRP ID: 0xffff8081ffed67a0
    IRP USBD_STATUS: USBD_STATUS_SUCCESS (0x00000000)
    URB Function: URB_FUNCTION_BULK_OR_INTERRUPT_TRANSFER (0x0009)
    IRP information: 0x01, Direction: PDO -> FDO
    URB bus id: 1
    Device address: 16
    Endpoint: 0x81, Direction: IN
    URB transfer type: URB_INTERRUPT (0x01)
    Packet Data Length: 8
    [Request in: 114]
    [Time from request: 0.199970000 seconds]
    [bInterfaceClass: HID (0x03)]
HID Data: 00001f0000000000
    .... ...0 = Key: LeftControl (0xe0): UP
    .... ..0. = Key: LeftShift (0xe1): UP
    .... .0.. = Key: LeftAlt (0xe2): UP
    .... 0... = Key: LeftGUI (0xe3): UP
    ...0 .... = Key: RightControl (0xe4): UP
    ..0. .... = Key: RightShift (0xe5): UP
    .0.. .... = Key: RightAlt (0xe6): UP
    0... .... = Key: RightGUI (0xe7): UP
    Padding: 00
    Array: 1f0000000000
        0001 1111 = Usage: Keyboard 2 and @ (0x0007, 0x001f)
        0000 0000 = Usage: Reserved (no event indicated) (0x0007, 0x0000)
        0000 0000 = Usage: Reserved (no event indicated) (0x0007, 0x0000)
        0000 0000 = Usage: Reserved (no event indicated) (0x0007, 0x0000)
        0000 0000 = Usage: Reserved (no event indicated) (0x0007, 0x0000)
        0000 0000 = Usage: Reserved (no event indicated) (0x0007, 0x0000)

No.     Time           Source                Destination           Protocol Length Info
    118 191.315081     host                  1.16.1                USB      27     URB_INTERRUPT in

Frame 118: 27 bytes on wire (216 bits), 27 bytes captured (216 bits) on interface \\.\USBPcap1, id 0
USB URB
    [Source: host]
    [Destination: 1.16.1]
    USBPcap pseudoheader length: 27
    IRP ID: 0xffff8081ffed67a0
    IRP USBD_STATUS: USBD_STATUS_SUCCESS (0x00000000)
    URB Function: URB_FUNCTION_BULK_OR_INTERRUPT_TRANSFER (0x0009)
    IRP information: 0x00, Direction: FDO -> PDO
    URB bus id: 1
    Device address: 16
    Endpoint: 0x81, Direction: IN
    URB transfer type: URB_INTERRUPT (0x01)
    Packet Data Length: 0
    [Response in: 121]
    [bInterfaceClass: HID (0x03)]

No.     Time           Source                Destination           Protocol Length Info
    119 191.323128     1.16.1                host                  USB      35     URB_INTERRUPT in

Frame 119: 35 bytes on wire (280 bits), 35 bytes captured (280 bits) on interface \\.\USBPcap1, id 0
USB URB
    [Source: 1.16.1]
    [Destination: host]
    USBPcap pseudoheader length: 27
    IRP ID: 0xffff8082152e77a0
    IRP USBD_STATUS: USBD_STATUS_SUCCESS (0x00000000)
    URB Function: URB_FUNCTION_BULK_OR_INTERRUPT_TRANSFER (0x0009)
    IRP information: 0x01, Direction: PDO -> FDO
    URB bus id: 1
    Device address: 16
    Endpoint: 0x81, Direction: IN
    URB transfer type: URB_INTERRUPT (0x01)
    Packet Data Length: 8
    [Request in: 116]
    [Time from request: 0.199985000 seconds]
    [bInterfaceClass: HID (0x03)]
HID Data: 0000000000000000
    .... ...0 = Key: LeftControl (0xe0): UP
    .... ..0. = Key: LeftShift (0xe1): UP
    .... .0.. = Key: LeftAlt (0xe2): UP
    .... 0... = Key: LeftGUI (0xe3): UP
    ...0 .... = Key: RightControl (0xe4): UP
    ..0. .... = Key: RightShift (0xe5): UP
    .0.. .... = Key: RightAlt (0xe6): UP
    0... .... = Key: RightGUI (0xe7): UP
    Padding: 00
    Array: 000000000000
        0000 0000 = Usage: Reserved (no event indicated) (0x0007, 0x0000)
        0000 0000 = Usage: Reserved (no event indicated) (0x0007, 0x0000)
        0000 0000 = Usage: Reserved (no event indicated) (0x0007, 0x0000)
        0000 0000 = Usage: Reserved (no event indicated) (0x0007, 0x0000)
        0000 0000 = Usage: Reserved (no event indicated) (0x0007, 0x0000)
        0000 0000 = Usage: Reserved (no event indicated) (0x0007, 0x0000)

No.     Time           Source                Destination           Protocol Length Info
    120 191.323334     host                  1.16.1                USB      27     URB_INTERRUPT in

Frame 120: 27 bytes on wire (216 bits), 27 bytes captured (216 bits) on interface \\.\USBPcap1, id 0
USB URB
    [Source: host]
    [Destination: 1.16.1]
    USBPcap pseudoheader length: 27
    IRP ID: 0xffff8082152e77a0
    IRP USBD_STATUS: USBD_STATUS_SUCCESS (0x00000000)
    URB Function: URB_FUNCTION_BULK_OR_INTERRUPT_TRANSFER (0x0009)
    IRP information: 0x00, Direction: FDO -> PDO
    URB bus id: 1
    Device address: 16
    Endpoint: 0x81, Direction: IN
    URB transfer type: URB_INTERRUPT (0x01)
    Packet Data Length: 0
    [Response in: 123]
    [bInterfaceClass: HID (0x03)]

No.     Time           Source                Destination           Protocol Length Info
    121 208.291041     1.16.1                host                  USB      35     URB_INTERRUPT in

Frame 121: 35 bytes on wire (280 bits), 35 bytes captured (280 bits) on interface \\.\USBPcap1, id 0
USB URB
    [Source: 1.16.1]
    [Destination: host]
    USBPcap pseudoheader length: 27
    IRP ID: 0xffff8081ffed67a0
    IRP USBD_STATUS: USBD_STATUS_SUCCESS (0x00000000)
    URB Function: URB_FUNCTION_BULK_OR_INTERRUPT_TRANSFER (0x0009)
    IRP information: 0x01, Direction: PDO -> FDO
    URB bus id: 1
    Device address: 16
    Endpoint: 0x81, Direction: IN
    URB transfer type: URB_INTERRUPT (0x01)
    Packet Data Length: 8
    [Request in: 118]
    [Time from request: 16.975960000 seconds]
    [bInterfaceClass: HID (0x03)]
HID Data: 00001f0000000000
    .... ...0 = Key: LeftControl (0xe0): UP
    .... ..0. = Key: LeftShift (0xe1): UP
    .... .0.. = Key: LeftAlt (0xe2): UP
    .... 0... = Key: LeftGUI (0xe3): UP
    ...0 .... = Key: RightControl (0xe4): UP
    ..0. .... = Key: RightShift (0xe5): UP
    .0.. .... = Key: RightAlt (0xe6): UP
    0... .... = Key: RightGUI (0xe7): UP
    Padding: 00
    Array: 1f0000000000
        0001 1111 = Usage: Keyboard 2 and @ (0x0007, 0x001f)
        0000 0000 = Usage: Reserved (no event indicated) (0x0007, 0x0000)
        0000 0000 = Usage: Reserved (no event indicated) (0x0007, 0x0000)
        0000 0000 = Usage: Reserved (no event indicated) (0x0007, 0x0000)
        0000 0000 = Usage: Reserved (no event indicated) (0x0007, 0x0000)
        0000 0000 = Usage: Reserved (no event indicated) (0x0007, 0x0000)

No.     Time           Source                Destination           Protocol Length Info
    122 208.291071     host                  1.16.1                USB      27     URB_INTERRUPT in

Frame 122: 27 bytes on wire (216 bits), 27 bytes captured (216 bits) on interface \\.\USBPcap1, id 0
USB URB
    [Source: host]
    [Destination: 1.16.1]
    USBPcap pseudoheader length: 27
    IRP ID: 0xffff8081ffed67a0
    IRP USBD_STATUS: USBD_STATUS_SUCCESS (0x00000000)
    URB Function: URB_FUNCTION_BULK_OR_INTERRUPT_TRANSFER (0x0009)
    IRP information: 0x00, Direction: FDO -> PDO
    URB bus id: 1
    Device address: 16
    Endpoint: 0x81, Direction: IN
    URB transfer type: URB_INTERRUPT (0x01)
    Packet Data Length: 0
    [Response in: 125]
    [bInterfaceClass: HID (0x03)]

No.     Time           Source                Destination           Protocol Length Info
    123 208.299051     1.16.1                host                  USB      35     URB_INTERRUPT in

Frame 123: 35 bytes on wire (280 bits), 35 bytes captured (280 bits) on interface \\.\USBPcap1, id 0
USB URB
    [Source: 1.16.1]
    [Destination: host]
    USBPcap pseudoheader length: 27
    IRP ID: 0xffff8082152e77a0
    IRP USBD_STATUS: USBD_STATUS_SUCCESS (0x00000000)
    URB Function: URB_FUNCTION_BULK_OR_INTERRUPT_TRANSFER (0x0009)
    IRP information: 0x01, Direction: PDO -> FDO
    URB bus id: 1
    Device address: 16
    Endpoint: 0x81, Direction: IN
    URB transfer type: URB_INTERRUPT (0x01)
    Packet Data Length: 8
    [Request in: 120]
    [Time from request: 16.975717000 seconds]
    [bInterfaceClass: HID (0x03)]
HID Data: 0000000000000000
    .... ...0 = Key: LeftControl (0xe0): UP
    .... ..0. = Key: LeftShift (0xe1): UP
    .... .0.. = Key: LeftAlt (0xe2): UP
    .... 0... = Key: LeftGUI (0xe3): UP
    ...0 .... = Key: RightControl (0xe4): UP
    ..0. .... = Key: RightShift (0xe5): UP
    .0.. .... = Key: RightAlt (0xe6): UP
    0... .... = Key: RightGUI (0xe7): UP
    Padding: 00
    Array: 000000000000
        0000 0000 = Usage: Reserved (no event indicated) (0x0007, 0x0000)
        0000 0000 = Usage: Reserved (no event indicated) (0x0007, 0x0000)
        0000 0000 = Usage: Reserved (no event indicated) (0x0007, 0x0000)
        0000 0000 = Usage: Reserved (no event indicated) (0x0007, 0x0000)
        0000 0000 = Usage: Reserved (no event indicated) (0x0007, 0x0000)
        0000 0000 = Usage: Reserved (no event indicated) (0x0007, 0x0000)

No.     Time           Source                Destination           Protocol Length Info
    124 208.299094     host                  1.16.1                USB      27     URB_INTERRUPT in

Frame 124: 27 bytes on wire (216 bits), 27 bytes captured (216 bits) on interface \\.\USBPcap1, id 0
USB URB
    [Source: host]
    [Destination: 1.16.1]
    USBPcap pseudoheader length: 27
    IRP ID: 0xffff8082152e77a0
    IRP USBD_STATUS: USBD_STATUS_SUCCESS (0x00000000)
    URB Function: URB_FUNCTION_BULK_OR_INTERRUPT_TRANSFER (0x0009)
    IRP information: 0x00, Direction: FDO -> PDO
    URB bus id: 1
    Device address: 16
    Endpoint: 0x81, Direction: IN
    URB transfer type: URB_INTERRUPT (0x01)
    Packet Data Length: 0
    [Response in: 127]
    [bInterfaceClass: HID (0x03)]

No.     Time           Source                Destination           Protocol Length Info
    125 208.491039     1.16.1                host                  USB      35     URB_INTERRUPT in

Frame 125: 35 bytes on wire (280 bits), 35 bytes captured (280 bits) on interface \\.\USBPcap1, id 0
USB URB
    [Source: 1.16.1]
    [Destination: host]
    USBPcap pseudoheader length: 27
    IRP ID: 0xffff8081ffed67a0
    IRP USBD_STATUS: USBD_STATUS_SUCCESS (0x00000000)
    URB Function: URB_FUNCTION_BULK_OR_INTERRUPT_TRANSFER (0x0009)
    IRP information: 0x01, Direction: PDO -> FDO
    URB bus id: 1
    Device address: 16
    Endpoint: 0x81, Direction: IN
    URB transfer type: URB_INTERRUPT (0x01)
    Packet Data Length: 8
    [Request in: 122]
    [Time from request: 0.199968000 seconds]
    [bInterfaceClass: HID (0x03)]
HID Data: 00001f0000000000
    .... ...0 = Key: LeftControl (0xe0): UP
    .... ..0. = Key: LeftShift (0xe1): UP
    .... .0.. = Key: LeftAlt (0xe2): UP
    .... 0... = Key: LeftGUI (0xe3): UP
    ...0 .... = Key: RightControl (0xe4): UP
    ..0. .... = Key: RightShift (0xe5): UP
    .0.. .... = Key: RightAlt (0xe6): UP
    0... .... = Key: RightGUI (0xe7): UP
    Padding: 00
    Array: 1f0000000000
        0001 1111 = Usage: Keyboard 2 and @ (0x0007, 0x001f)
        0000 0000 = Usage: Reserved (no event indicated) (0x0007, 0x0000)
        0000 0000 = Usage: Reserved (no event indicated) (0x0007, 0x0000)
        0000 0000 = Usage: Reserved (no event indicated) (0x0007, 0x0000)
        0000 0000 = Usage: Reserved (no event indicated) (0x0007, 0x0000)
        0000 0000 = Usage: Reserved (no event indicated) (0x0007, 0x0000)

No.     Time           Source                Destination           Protocol Length Info
    126 208.491070     host                  1.16.1                USB      27     URB_INTERRUPT in

Frame 126: 27 bytes on wire (216 bits), 27 bytes captured (216 bits) on interface \\.\USBPcap1, id 0
USB URB
    [Source: host]
    [Destination: 1.16.1]
    USBPcap pseudoheader length: 27
    IRP ID: 0xffff8081ffed67a0
    IRP USBD_STATUS: USBD_STATUS_SUCCESS (0x00000000)
    URB Function: URB_FUNCTION_BULK_OR_INTERRUPT_TRANSFER (0x0009)
    IRP information: 0x00, Direction: FDO -> PDO
    URB bus id: 1
    Device address: 16
    Endpoint: 0x81, Direction: IN
    URB transfer type: URB_INTERRUPT (0x01)
    Packet Data Length: 0
    [Response in: 129]
    [bInterfaceClass: HID (0x03)]

No.     Time           Source                Destination           Protocol Length Info
    127 208.499065     1.16.1                host                  USB      35     URB_INTERRUPT in

Frame 127: 35 bytes on wire (280 bits), 35 bytes captured (280 bits) on interface \\.\USBPcap1, id 0
USB URB
    [Source: 1.16.1]
    [Destination: host]
    USBPcap pseudoheader length: 27
    IRP ID: 0xffff8082152e77a0
    IRP USBD_STATUS: USBD_STATUS_SUCCESS (0x00000000)
    URB Function: URB_FUNCTION_BULK_OR_INTERRUPT_TRANSFER (0x0009)
    IRP information: 0x01, Direction: PDO -> FDO
    URB bus id: 1
    Device address: 16
    Endpoint: 0x81, Direction: IN
    URB transfer type: URB_INTERRUPT (0x01)
    Packet Data Length: 8
    [Request in: 124]
    [Time from request: 0.199971000 seconds]
    [bInterfaceClass: HID (0x03)]
HID Data: 0000000000000000
    .... ...0 = Key: LeftControl (0xe0): UP
    .... ..0. = Key: LeftShift (0xe1): UP
    .... .0.. = Key: LeftAlt (0xe2): UP
    .... 0... = Key: LeftGUI (0xe3): UP
    ...0 .... = Key: RightControl (0xe4): UP
    ..0. .... = Key: RightShift (0xe5): UP
    .0.. .... = Key: RightAlt (0xe6): UP
    0... .... = Key: RightGUI (0xe7): UP
    Padding: 00
    Array: 000000000000
        0000 0000 = Usage: Reserved (no event indicated) (0x0007, 0x0000)
        0000 0000 = Usage: Reserved (no event indicated) (0x0007, 0x0000)
        0000 0000 = Usage: Reserved (no event indicated) (0x0007, 0x0000)
        0000 0000 = Usage: Reserved (no event indicated) (0x0007, 0x0000)
        0000 0000 = Usage: Reserved (no event indicated) (0x0007, 0x0000)
        0000 0000 = Usage: Reserved (no event indicated) (0x0007, 0x0000)

No.     Time           Source                Destination           Protocol Length Info
    128 208.499118     host                  1.16.1                USB      27     URB_INTERRUPT in

Frame 128: 27 bytes on wire (216 bits), 27 bytes captured (216 bits) on interface \\.\USBPcap1, id 0
USB URB
    [Source: host]
    [Destination: 1.16.1]
    USBPcap pseudoheader length: 27
    IRP ID: 0xffff8082152e77a0
    IRP USBD_STATUS: USBD_STATUS_SUCCESS (0x00000000)
    URB Function: URB_FUNCTION_BULK_OR_INTERRUPT_TRANSFER (0x0009)
    IRP information: 0x00, Direction: FDO -> PDO
    URB bus id: 1
    Device address: 16
    Endpoint: 0x81, Direction: IN
    URB transfer type: URB_INTERRUPT (0x01)
    Packet Data Length: 0
    [Response in: 131]
    [bInterfaceClass: HID (0x03)]

No.     Time           Source                Destination           Protocol Length Info
    129 208.531044     1.16.1                host                  USB      35     URB_INTERRUPT in

Frame 129: 35 bytes on wire (280 bits), 35 bytes captured (280 bits) on interface \\.\USBPcap1, id 0
USB URB
    [Source: 1.16.1]
    [Destination: host]
    USBPcap pseudoheader length: 27
    IRP ID: 0xffff8081ffed67a0
    IRP USBD_STATUS: USBD_STATUS_SUCCESS (0x00000000)
    URB Function: URB_FUNCTION_BULK_OR_INTERRUPT_TRANSFER (0x0009)
    IRP information: 0x01, Direction: PDO -> FDO
    URB bus id: 1
    Device address: 16
    Endpoint: 0x81, Direction: IN
    URB transfer type: URB_INTERRUPT (0x01)
    Packet Data Length: 8
    [Request in: 126]
    [Time from request: 0.039974000 seconds]
    [bInterfaceClass: HID (0x03)]
HID Data: 0000010101010101
    .... ...0 = Key: LeftControl (0xe0): UP
    .... ..0. = Key: LeftShift (0xe1): UP
    .... .0.. = Key: LeftAlt (0xe2): UP
    .... 0... = Key: LeftGUI (0xe3): UP
    ...0 .... = Key: RightControl (0xe4): UP
    ..0. .... = Key: RightShift (0xe5): UP
    .0.. .... = Key: RightAlt (0xe6): UP
    0... .... = Key: RightGUI (0xe7): UP
    Padding: 00
    Array: 010101010101
        0000 0001 = Usage: Keyboard ErrorRollOver (0x0007, 0x0001)
        0000 0001 = Usage: Keyboard ErrorRollOver (0x0007, 0x0001)
        0000 0001 = Usage: Keyboard ErrorRollOver (0x0007, 0x0001)
        0000 0001 = Usage: Keyboard ErrorRollOver (0x0007, 0x0001)
        0000 0001 = Usage: Keyboard ErrorRollOver (0x0007, 0x0001)
        0000 0001 = Usage: Keyboard ErrorRollOver (0x0007, 0x0001)

No.     Time           Source                Destination           Protocol Length Info
    130 208.531071     host                  1.16.1                USB      27     URB_INTERRUPT in

Frame 130: 27 bytes on wire (216 bits), 27 bytes captured (216 bits) on interface \\.\USBPcap1, id 0
USB URB
    [Source: host]
    [Destination: 1.16.1]
    USBPcap pseudoheader length: 27
    IRP ID: 0xffff8081ffed67a0
    IRP USBD_STATUS: USBD_STATUS_SUCCESS (0x00000000)
    URB Function: URB_FUNCTION_BULK_OR_INTERRUPT_TRANSFER (0x0009)
    IRP information: 0x00, Direction: FDO -> PDO
    URB bus id: 1
    Device address: 16
    Endpoint: 0x81, Direction: IN
    URB transfer type: URB_INTERRUPT (0x01)
    Packet Data Length: 0
    [bInterfaceClass: HID (0x03)]

No.     Time           Source                Destination           Protocol Length Info
    131 208.539042     1.16.1                host                  USB      35     URB_INTERRUPT in

Frame 131: 35 bytes on wire (280 bits), 35 bytes captured (280 bits) on interface \\.\USBPcap1, id 0
USB URB
    [Source: 1.16.1]
    [Destination: host]
    USBPcap pseudoheader length: 27
    IRP ID: 0xffff8082152e77a0
    IRP USBD_STATUS: USBD_STATUS_SUCCESS (0x00000000)
    URB Function: URB_FUNCTION_BULK_OR_INTERRUPT_TRANSFER (0x0009)
    IRP information: 0x01, Direction: PDO -> FDO
    URB bus id: 1
    Device address: 16
    Endpoint: 0x81, Direction: IN
    URB transfer type: URB_INTERRUPT (0x01)
    Packet Data Length: 8
    [Request in: 128]
    [Time from request: 0.039924000 seconds]
    [bInterfaceClass: HID (0x03)]
HID Data: 0000000000000000
    .... ...0 = Key: LeftControl (0xe0): UP
    .... ..0. = Key: LeftShift (0xe1): UP
    .... .0.. = Key: LeftAlt (0xe2): UP
    .... 0... = Key: LeftGUI (0xe3): UP
    ...0 .... = Key: RightControl (0xe4): UP
    ..0. .... = Key: RightShift (0xe5): UP
    .0.. .... = Key: RightAlt (0xe6): UP
    0... .... = Key: RightGUI (0xe7): UP
    Padding: 00
    Array: 000000000000
        0000 0000 = Usage: Reserved (no event indicated) (0x0007, 0x0000)
        0000 0000 = Usage: Reserved (no event indicated) (0x0007, 0x0000)
        0000 0000 = Usage: Reserved (no event indicated) (0x0007, 0x0000)
        0000 0000 = Usage: Reserved (no event indicated) (0x0007, 0x0000)
        0000 0000 = Usage: Reserved (no event indicated) (0x0007, 0x0000)
        0000 0000 = Usage: Reserved (no event indicated) (0x0007, 0x0000)

No.     Time           Source                Destination           Protocol Length Info
    132 208.539067     host                  1.16.1                USB      27     URB_INTERRUPT in

Frame 132: 27 bytes on wire (216 bits), 27 bytes captured (216 bits) on interface \\.\USBPcap1, id 0
USB URB
    [Source: host]
    [Destination: 1.16.1]
    USBPcap pseudoheader length: 27
    IRP ID: 0xffff8082152e77a0
    IRP USBD_STATUS: USBD_STATUS_SUCCESS (0x00000000)
    URB Function: URB_FUNCTION_BULK_OR_INTERRUPT_TRANSFER (0x0009)
    IRP information: 0x00, Direction: FDO -> PDO
    URB bus id: 1
    Device address: 16
    Endpoint: 0x81, Direction: IN
    URB transfer type: URB_INTERRUPT (0x01)
    Packet Data Length: 0
    [bInterfaceClass: HID (0x03)]
